product_url,name,brand,major_category,subtype,price,rating,rating_count,active_tags,function_tags,skintype,ingredients_raw,ingredients_list,image_url,image_local,source,bv_product_id
https://www.sephora.co.th/products/caudalie-vinopure-purifying-gel-cleanser/v/150-ml,Vinopure Purifying Gel Cleanser,CAUDALIE,cleanser,bha_exfoliator,,,,bha,"acne_control,calming,exfoliating,hydrating",sensitive,"Aqua/Water/Eau, Vitis Vinifera (Grape) Fruit Water*, Decyl Glucoside, Glycerin, Sodium Cocoyl Glutamate, Sucrose Cocoate, Acacia Senegal Gum, Xanthan Gum, Propylene Glycol, Citric Acid, Aloe Barbadensis Leaf Powder*, Salicylic Acid, Vitis Vinifera (Grape) Juice*, Sodium Benzoate, Pelargonium Graveolens Flower Oil*, Mentha Piperita (Peppermint) Oil*, Citral, Cymbopogon Citratus Leaf Oil*, Rosmarinus Officinalis (Rosemary) Leaf Oil*, Citronellol, Geraniol, Potassium Sorbate, Linalool, Lavandula Hybrida Oil*, Melissa Officinalis Leaf Oil*. (303/002) *From Organic Farming. 99% Natural Origin Of Total. 28% Of The Total Ingredients Are From Organic Farming. Cosmos Organic Certified By Ecocert Greenlife According To Cosmos Standard.","Aqua/Water/Eau,Vitis Vinifera (Grape) Fruit Water*,Decyl Glucoside,Glycerin,Sodium Cocoyl Glutamate,Sucrose Cocoate,Acacia Senegal Gum,Xanthan Gum,Propylene Glycol,Citric Acid,Aloe Barbadensis Leaf Powder*,Salicylic Acid,Vitis Vinifera (Grape) Juice*,Sodium Benzoate,Pelargonium Graveolens Flower Oil*,Mentha Piperita (Peppermint) Oil*,Citral,Cymbopogon Citratus Leaf Oil*,Rosmarinus Officinalis (Rosemary) Leaf Oil*,Citronellol,Geraniol,Potassium Sorbate,Linalool,Lavandula Hybrida Oil*,Melissa Officinalis Leaf Oil*. (303/002) *From Organic Farming. 99% Natural Origin Of Total. 28% Of The Total Ingredients Are From Organic Farming. Cosmos Organic Certified By Ecocert Greenlife According To Cosmos Standard.",https://image-optimizer-th.production.sephora-asia.net/images/product_images/closeup_1_Product_3522931005055-Caudalie-Vinopure-Purifying-Gel-Clea_0f2d3f9d0cda24306c76194f5c5895bdde903e46_1753268308.png?o=clean-planet-aware,C:\Users\Petch\Desktop\Projectskin\skincare-ai-recomender\backend\scraper\data_products\images\sep_bee1f8f9d55b.jpg,sephora_th,thailand-16106-156998
https://www.sephora.co.th/products/caudalie-vinoclean-instant-foaming-cleanser/v/150ml,Vinoclean Instant Foaming Cleanser,CAUDALIE,cleanser,aha_exfoliator,,,,aha,exfoliating,combination,"บัญชีของฉัน ลงทะเบียน|เข้าสู่ระบบ GET THE APP สาขา และ กิจกรรม จองคิวบริการ BEAUTY SERVICE ไทย ถุงชอปปิง เพลิดเพลินกับการเป็นสมาชิกบิวตี้พาส ลด 10% ทุกชิ้น ไม่มีขั้นตำ่ เมื่อชอปบนออนไลน์ครั้งแรก ใช้โค้ด WELCOME สะสมคะแนนบิ้วตี้พาสเพื่อรับของขวัญและส่วนลดต่างๆ รับฟรี 50 คะแนน เมื่อสมัครสมาชิก และสิทธิะิเศษอีกมากมาย! เข้าสู่ระบบ ลงทะเบียน FREE SHIPPING เมื่อชอปครบ ฿500 ขึ้นไป ฟรี สินค้าขนาดทดลอง ทุกการสั่งซื้อ จนกว่าสินค้าจะหมด! ใหม่ เมคอัป สกินแคร์ ดูแลเส้นผม อุปกรณ์เสริมสวย ดูแลผิวกาย น้ำหอม คลีนบิวตี้ ของขวัญ และบัตรของขวัญ แบรนด์ โปรโมชั่น Home Caudalie Vinoclean Instant Foaming Cleanser CAUDALIE Vinoclean Instant Foaming Cleanser 150ml ฿1, 030.00 เพิ่มในถุงช็อปปิ้ง ที่เซโฟราเท่านั้น CAUDALIE Vinoclean Instant Foaming Cleanser 4.5 จาก 5 ดาว ค่าคะแนนเฉลี่ย Read 507 Reviews. ลิงก์หน้าเดียวกัน 4.5 (507) เขียนบทวิจารณ์ ฿1, 030.00 ขนาด: 150ml 150ml50ml ดูขนาดทั้งหมด จำนวน: 1 2 3 4 5 6 เพิ่มในถุงช็อปปิ้ง คำอธิบาย ประเภทของผิว: ผิวผสม, ผิวมัน, ผิวธรรมดา, ผิวแห้ง ความกังวลเรื่องผิว: ความแห้งกร้าน สูตร: Foam + ดูคำบรรยายทั้งหมด ส่วนประกอบ Product Claims: AHAs/Glycolic Acid, Clean at Sephora, ไม่มีน้ำมัน, ไม่มีพาราเบน, ไม่มีซัลเฟต + ดูส่วนผสมทั้งหมด วิธีการใช้งาน ไม่ต้องเขย่าก่อนใช้ สามารถกดคลีนเซอร์บนฝ่ามือได้ทันที ลงบนผิวเปียก หลับตาและนวดวนทั่วใบหน้า อย่าลืมบริเวณคอ ล้างออกให้สะอาดด้วยน้ำปริมาณมาก ปิดฝาทุกครั้งหลังใช้เสร็จ การจัดส่ง จัดส่งไปตามที่อยู่ที่ระบุ ส่งฟรี เมื่อสั่งซื้อครบ ฿500.00 บาทขึ้นไป Standard Shipping: ฿59.00 ได้รับระหว่าง 13 Mar - 17 Mar แนะนำสำหรับคุณ CAUDALIE Vinopure Purifying Gel Cleanser ฿1, 050.00 CAUDALIE Vinoclean Makeup Removing Cleansing Oil ฿1, 120.00 CAUDALIE Vinoclean Micellar Cleansing Water ฿1, 030.00 CAUDALIE Vinoclean Gentle Cleansing Almond Milk ฿1, 030.00 CAUDALIE Vinoclean Instant Foaming Cleanser Duo ฿1, 550.00 CAUDALIE Vinohydra Moisturizing Cleansing Gel ฿990.00 CAUDALIE Vinoperfect Brightening Dark Spot Serum ฿2, 920.00 CAUDALIE Vinopure Skin Perfecting Matifying Fluid ฿1, 250.00 CAUDALIE Vinohydra Moisturizing Duo (Holiday Limited Edition) ฿1, 350.00 CAUDALIE Vinoperfect Instant Brightening Micropeel ฿1, 400.00 เกี่ยวกับเรา เกี่ยวกับ Sephora ร่วมงานกับเรา นโยบายความเป็นส่วนตัว เงื่อนไขการใช้งาน International ผังไซต์ ศูนย์บริการลูกค้า การจัดส่ง คำถามที่พบบ่อย จองคิวบริการ Beauty Service ค้นหากิจกรรมที่ร้านเซโฟรา ค้นหาสาขา ติดต่อเรา EARN REWARDS AS A BEAUTY PASS MEMBER LEARN MORE ติดตามเรา ดาวน์โหลดแอพได้เลย ดาวน์โหลดแอพแล้วเริ่มช้อปได้เลย! ช่องทางการชำระเงิน Copyright © 2026 Sephora Digital SEA Pte Ltd เงื่อนไขการใช้งาน|นโยบายความเป็นส่วนตัว","บัญชีของฉัน ลงทะเบียน|เข้าสู่ระบบ GET THE APP สาขา และ กิจกรรม จองคิวบริการ BEAUTY SERVICE ไทย ถุงชอปปิง เพลิดเพลินกับการเป็นสมาชิกบิวตี้พาส ลด 10% ทุกชิ้น ไม่มีขั้นตำ่ เมื่อชอปบนออนไลน์ครั้งแรก ใช้โค้ด WELCOME สะสมคะแนนบิ้วตี้พาสเพื่อรับของขวัญและส่วนลดต่างๆ รับฟรี 50 คะแนน เมื่อสมัครสมาชิก และสิทธิะิเศษอีกมากมาย! เข้าสู่ระบบ ลงทะเบียน FREE SHIPPING เมื่อชอปครบ ฿500 ขึ้นไป ฟรี สินค้าขนาดทดลอง ทุกการสั่งซื้อ จนกว่าสินค้าจะหมด! ใหม่ เมคอัป สกินแคร์ ดูแลเส้นผม อุปกรณ์เสริมสวย ดูแลผิวกาย น้ำหอม คลีนบิวตี้ ของขวัญ และบัตรของขวัญ แบรนด์ โปรโมชั่น Home Caudalie Vinoclean Instant Foaming Cleanser CAUDALIE Vinoclean Instant Foaming Cleanser 150ml ฿1,030.00 เพิ่มในถุงช็อปปิ้ง ที่เซโฟราเท่านั้น CAUDALIE Vinoclean Instant Foaming Cleanser 4.5 จาก 5 ดาว ค่าคะแนนเฉลี่ย Read 507 Reviews. ลิงก์หน้าเดียวกัน 4.5 (507) เขียนบทวิจารณ์ ฿1,030.00 ขนาด: 150ml 150ml50ml ดูขนาดทั้งหมด จำนวน: 1 2 3 4 5 6 เพิ่มในถุงช็อปปิ้ง คำอธิบาย ประเภทของผิว: ผิวผสม,ผิวมัน,ผิวธรรมดา,ผิวแห้ง ความกังวลเรื่องผิว: ความแห้งกร้าน สูตร: Foam + ดูคำบรรยายทั้งหมด ส่วนประกอบ Product Claims: AHAs/Glycolic Acid,Clean at Sephora,ไม่มีน้ำมัน,ไม่มีพาราเบน,ไม่มีซัลเฟต + ดูส่วนผสมทั้งหมด วิธีการใช้งาน ไม่ต้องเขย่าก่อนใช้ สามารถกดคลีนเซอร์บนฝ่ามือได้ทันที ลงบนผิวเปียก หลับตาและนวดวนทั่วใบหน้า อย่าลืมบริเวณคอ ล้างออกให้สะอาดด้วยน้ำปริมาณมาก ปิดฝาทุกครั้งหลังใช้เสร็จ การจัดส่ง จัดส่งไปตามที่อยู่ที่ระบุ ส่งฟรี เมื่อสั่งซื้อครบ ฿500.00 บาทขึ้นไป Standard Shipping: ฿59.00 ได้รับระหว่าง 13 Mar - 17 Mar แนะนำสำหรับคุณ CAUDALIE Vinopure Purifying Gel Cleanser ฿1,050.00 CAUDALIE Vinoclean Makeup Removing Cleansing Oil ฿1,120.00 CAUDALIE Vinoclean Micellar Cleansing Water ฿1,030.00 CAUDALIE Vinoclean Gentle Cleansing Almond Milk ฿1,030.00 CAUDALIE Vinoclean Instant Foaming Cleanser Duo ฿1,550.00 CAUDALIE Vinohydra Moisturizing Cleansing Gel ฿990.00 CAUDALIE Vinoperfect Brightening Dark Spot Serum ฿2,920.00 CAUDALIE Vinopure Skin Perfecting Matifying Fluid ฿1,250.00 CAUDALIE Vinohydra Moisturizing Duo (Holiday Limited Edition) ฿1,350.00 CAUDALIE Vinoperfect Instant Brightening Micropeel ฿1,400.00 เกี่ยวกับเรา เกี่ยวกับ Sephora ร่วมงานกับเรา นโยบายความเป็นส่วนตัว เงื่อนไขการใช้งาน International ผังไซต์ ศูนย์บริการลูกค้า การจัดส่ง คำถามที่พบบ่อย จองคิวบริการ Beauty Service ค้นหากิจกรรมที่ร้านเซโฟรา ค้นหาสาขา ติดต่อเรา EARN REWARDS AS A BEAUTY PASS MEMBER LEARN MORE ติดตามเรา ดาวน์โหลดแอพได้เลย ดาวน์โหลดแอพแล้วเริ่มช้อปได้เลย! ช่องทางการชำระเงิน Copyright © 2026 Sephora Digital SEA Pte Ltd เงื่อนไขการใช้งาน|นโยบายความเป็นส่วนตัว",https://image-optimizer-th.production.sephora-asia.net/images/product_images/closeup_2_Product_3522931003075-Caudalie-Vinoclean-Instant-Foaming-Cleanser-150ml_43f8c80364650546011153f38e7d308e82a53bd9_1619268058.png?o=clean-planet-aware,C:\Users\Petch\Desktop\Projectskin\skincare-ai-recomender\backend\scraper\data_products\images\sep_3d3d4bc4f1af.jpg,sephora_th,thailand-22187-43848
https://www.sephora.co.th/products/biossance-squalane-plus-amino-aloe-gentle-cleanser/v/200ml,Squalane + Amino Aloe Gentle Cleanser,BIOSSANCE,cleanser,cleanser,,,,,"calming,hydrating",dry,"Water/Aqua/Eau, Aloe Barbadensis Leaf Juice, Cocamidopropyl Hydroxysultaine, Glycerin, Sodium Cocoyl Isethionate, Disodium Coco-Glucoside Citrate, Squalane, Cocoyl Proline, Moringa Oleifera Leaf Extract, Rosmarinus Officinalis (Rosemary) Leaf Oil, Cymbopogon Schoenanthus Oil, Pelargonium Graveolens Oil, Salvia Sclarea (Clary) Oil, Hydrolyzed Pea Protein, Medicago Sativa (Alfalfa) Extract, Sodium Levulinate, Caramel, Magnesium Chloride, Potassium Sorbate, Sodium Gluconate, Citric Acid, Citral, Citronellol, Linalool.","Water/Aqua/Eau,Aloe Barbadensis Leaf Juice,Cocamidopropyl Hydroxysultaine,Glycerin,Sodium Cocoyl Isethionate,Disodium Coco-Glucoside Citrate,Squalane,Cocoyl Proline,Moringa Oleifera Leaf Extract,Rosmarinus Officinalis (Rosemary) Leaf Oil,Cymbopogon Schoenanthus Oil,Pelargonium Graveolens Oil,Salvia Sclarea (Clary) Oil,Hydrolyzed Pea Protein,Medicago Sativa (Alfalfa) Extract,Sodium Levulinate,Caramel,Magnesium Chloride,Potassium Sorbate,Sodium Gluconate,Citric Acid,Citral,Citronellol,Linalool.",https://image-optimizer-th.production.sephora-asia.net/images/product_images/closeup_1_Product_810029621434-Biossance-Squalane-Amino-Aloe-Gentle-_443d72712e04eda85389038ed2bbe8670372bb78_1721209539.png?o=clean-planet-aware,C:\Users\Petch\Desktop\Projectskin\skincare-ai-recomender\backend\scraper\data_products\images\sep_a60650c94e7b.jpg,sephora_th,thailand-28120-137417
https://www.sephora.co.th/products/biossance-squalane-plus-antioxidant-cleansing-oil/v/200ml-35599,Squalane + Antioxidant Cleansing Oil,BIOSSANCE,cleanser,cleanser,,,,,,all,,,https://image-optimizer-th.production.sephora-asia.net/images/product_images/closeup_1_Product_859049007613-Biossance-Squalane-Antioxidant-Cleans_9fcf5face6e87aad5081796b1762483f52c6645b_1721208412.png?o=clean-planet-aware,C:\Users\Petch\Desktop\Projectskin\skincare-ai-recomender\backend\scraper\data_products\images\sep_97eab8b6cd80.jpg,sephora_th,thailand-14388-35599
https://www.sephora.co.th/products/drunk-elephant-mello-marula-cream-cleanser/v/150ml,Mello Marula™ Cream Cleanser,DRUNK ELEPHANT,cleanser,cleanser,,,,,"antioxidant,calming,hydrating",sensitive,"Water/Aqua/Eau, Glycerin, Cocamidopropyl Betaine, Coco-Glucoside, Sodium Lauroyl Methyl Isethionate, Cocamidopropyl Hydroxysultaine, Sodium Methyl Oleoyl Taurate, Propanediol, Aloe Barbadensis Leaf Extract, Glycolipids, Linoleic Acid, Linolenic Acid, Lauryl Glucoside, Cucumis Melo Cantalupensis Fruit Extract, Sclerocarya Birrea Seed Oil, Dipotassium Glycyrrhizate, Tocopherol, Citric Acid, Phenoxyethanol, Sodium Hydroxide, Sodium Benzoate, Sodium Chloride, Polylysine","Water/Aqua/Eau,Glycerin,Cocamidopropyl Betaine,Coco-Glucoside,Sodium Lauroyl Methyl Isethionate,Cocamidopropyl Hydroxysultaine,Sodium Methyl Oleoyl Taurate,Propanediol,Aloe Barbadensis Leaf Extract,Glycolipids,Linoleic Acid,Linolenic Acid,Lauryl Glucoside,Cucumis Melo Cantalupensis Fruit Extract,Sclerocarya Birrea Seed Oil,Dipotassium Glycyrrhizate,Tocopherol,Citric Acid,Phenoxyethanol,Sodium Hydroxide,Sodium Benzoate,Sodium Chloride,Polylysine",https://image-optimizer-th.production.sephora-asia.net/images/product_images/closeup_1_Product_194249406461-Drunk-Elephant-Mello-Marula-Cream-Cle_c155c0e410b3bb60338eef3ce8667680bbfd63c5_1727952030.png?o=clean,C:\Users\Petch\Desktop\Projectskin\skincare-ai-recomender\backend\scraper\data_products\images\sep_48e084ad7c89.jpg,sephora_th,thailand-100500-151915
