product_url,name,brand,major_category,subtype,price,rating,rating_count,active_tags,function_tags,skintype,ingredients_raw,ingredients_list,image_url,image_local,source,bv_product_id
https://www.sephora.co.th/products/sephora-collection-hydrate-bouncy-water-jelly/v/50ml,Hydrate Bouncy Water Jelly,SEPHORA COLLECTION,moisturizer,moisturizer,,,,,hydrating,dry,"Aqua (Water), Glycerin, 2-Hexanediol, Saccharide Isomerate, Carbomer, Chlorphenesin, Maltodextrin, Glucomannan, Sodium Citrate, Sodium Hyaluronate, Polyglutamic Acid, Sodium Hydroxide, Biosaccharide Gum-1, Citric Acid, CI 42090 (Blue 1).","Aqua (Water),Glycerin,2-Hexanediol,Saccharide Isomerate,Carbomer,Chlorphenesin,Maltodextrin,Glucomannan,Sodium Citrate,Sodium Hyaluronate,Polyglutamic Acid,Sodium Hydroxide,Biosaccharide Gum-1,Citric Acid,CI 42090 (Blue 1).",https://image-optimizer-th.production.sephora-asia.net/images/product_images/closeup_1_Product_3378870202716-Sephora-Collection-Hydrate-Bouncy-Wa_8e7d4b8461f17cca33eda15dc1e9ac0376532c71_1771239464.png,C:\Users\Petch\Desktop\Projectskin\skincare-ai-recomender\backend\scraper\data_products\images\sep_d8eb7cfedb25.jpg,sephora_th,thailand-103632-155893
https://www.sephora.co.th/products/sephora-collection-lift-and-firm-plumping-day-cream-with-peptides-plus-hyaluronic-acid-refill/v/50ml,Lift & Firm Plumping Day Cream With Peptides + Hyaluronic Acid Refill,SEPHORA COLLECTION,moisturizer,moisturizer,,,,,"hydrating,moisturizing",dry,"Aqua (Water), Glycerin, C15-19 Alkane, Simmondsia Chinensis (Jojoba) Seed Oil, C10-18 Triglycerides, Octyldodecanol, Glyceryl Oleate Citrate, Methylpropanediol, Pentylene Glycol, Sodium Acrylates Copolymer, Carbomer, Lecithin, Sodium Gluconate, Sodium Hydroxide, Hydrolyzed Vegetable Protein, Sodium Citrate, Sodium Benzoate, Sodium Hyaluronate, O-Cymen-5-Ol, Polyglutamic Acid.","Aqua (Water),Glycerin,C15-19 Alkane,Simmondsia Chinensis (Jojoba) Seed Oil,C10-18 Triglycerides,Octyldodecanol,Glyceryl Oleate Citrate,Methylpropanediol,Pentylene Glycol,Sodium Acrylates Copolymer,Carbomer,Lecithin,Sodium Gluconate,Sodium Hydroxide,Hydrolyzed Vegetable Protein,Sodium Citrate,Sodium Benzoate,Sodium Hyaluronate,O-Cymen-5-Ol,Polyglutamic Acid.",https://image-optimizer-th.production.sephora-asia.net/images/product_images/closeup_1_Product_3378870193854-Sephora-Collection-Lift--Firm-Plumpi_ab926bee49d5709190c32753006e728c2a660987_1773054276.png,C:\Users\Petch\Desktop\Projectskin\skincare-ai-recomender\backend\scraper\data_products\images\sep_7e1e59f8d7f0.jpg,sephora_th,thailand-103858-152644
https://www.sephora.co.th/products/sephora-collection-glow-brightening-gel-cream-with-vitamin-c-plus-polyglutamic-acid-refill/v/50ml,Glow Brightening Gel Cream With Vitamin C + Polyglutamic Acid Refill,SEPHORA COLLECTION,moisturizer,moisturizer,,,,vitamin_c,"antioxidant,brightening,hydrating,moisturizing","dry,sensitive","Aqua (Water), Caprylic/Capric Triglyceride, Glycerin, Propanediol, Sodium Polyacryloyldimethyl Taurate, 3-O-Ethyl Ascorbic Acid, C15-19 Alkane, Coco-Caprylate/Caprate, Polyglyceryl-6 Stearate, Sodium Citrate, Citric Acid, Hydroxyacetophenone, 2-Hexanediol, Caprylyl Glycol, C10-18 Triglycerides, Sodium Benzoate, Polyglyceryl-6 Behenate, Tetrasodium Glutamate Diacetate, Tocopherol, Helianthus Annuus (Sunflower) Seed Oil, Polyglutamic Acid, Ci 15510 (Orange 4), Ci 19140 (Yellow 5), Sodium Hydroxide.","Aqua (Water),Caprylic/Capric Triglyceride,Glycerin,Propanediol,Sodium Polyacryloyldimethyl Taurate,3-O-Ethyl Ascorbic Acid,C15-19 Alkane,Coco-Caprylate/Caprate,Polyglyceryl-6 Stearate,Sodium Citrate,Citric Acid,Hydroxyacetophenone,2-Hexanediol,Caprylyl Glycol,C10-18 Triglycerides,Sodium Benzoate,Polyglyceryl-6 Behenate,Tetrasodium Glutamate Diacetate,Tocopherol,Helianthus Annuus (Sunflower) Seed Oil,Polyglutamic Acid,Ci 15510 (Orange 4),Ci 19140 (Yellow 5),Sodium Hydroxide.",https://image-optimizer-th.production.sephora-asia.net/images/product_images/closeup_1_Product_3378870193830-Sephora-Collection-Glow-Brightening-_66d70ed36b6955ea20c0381a0682cd7312b07d12_1773054311.png,C:\Users\Petch\Desktop\Projectskin\skincare-ai-recomender\backend\scraper\data_products\images\sep_9e8675de1a63.jpg,sephora_th,thailand-103857-152643
https://www.sephora.co.th/products/caudalie-resveratrol-lift-firming-night-cream/v/50ml,Resveratrol-Lift Firming Night Cream,CAUDALIE,moisturizer,moisturizer,,,,peptide,"anti_aging,hydrating,moisturizing",dry,"Aqua/Water/Eau, Butylene Glycol, Glycerin, Cococaprylate/Caprate, Squalane, Cetearyl Alcohol, Caprylic/Capric Triglyceride, Hydrogenated Vegetable Oil, Triheptanoin, Vitis Vinifera Grape Seed Oil, Citrus Aurantium Amara Bitter Orange Flower Water, Arachidyl Alcohol, Carbomer, Palmitoyl Grapevine Shoot Extract, Parfum Fragrance, Behenyl Alcohol, Potassium Sorbate, Caprylyl Glycol, Cetearyl Glucoside, Arachidyl Glucoside, Hydrolyzed Hyaluronic Acid, Xanthan Gum, Sodium Hydroxide, Tocopheryl Acetate, Adenosine, Tilia Platyphyllos Flower Extract, Verbena Officinalis Leaf Extract, Acetyl Dipeptide 1 Cetyl Ester, Hyaluronic Acid, Helianthus Annuus Sunflower˛ Seed Oil, Pentylene Glycol, Khaya Senegalensis Bark Extract, Maltodextrin, Linalool, Limonene, Citric Acid, Paeonia Lactiflora Root Extract, Coumarin, Sodium Benzoate, Nicotiana Benthamiana Hexapeptide 40 Sh Polypeptide 47. (260/018)","Aqua/Water/Eau,Butylene Glycol,Glycerin,Cococaprylate/Caprate,Squalane,Cetearyl Alcohol,Caprylic/Capric Triglyceride,Hydrogenated Vegetable Oil,Triheptanoin,Vitis Vinifera Grape Seed Oil,Citrus Aurantium Amara Bitter Orange Flower Water,Arachidyl Alcohol,Carbomer,Palmitoyl Grapevine Shoot Extract,Parfum Fragrance,Behenyl Alcohol,Potassium Sorbate,Caprylyl Glycol,Cetearyl Glucoside,Arachidyl Glucoside,Hydrolyzed Hyaluronic Acid,Xanthan Gum,Sodium Hydroxide,Tocopheryl Acetate,Adenosine,Tilia Platyphyllos Flower Extract,Verbena Officinalis Leaf Extract,Acetyl Dipeptide 1 Cetyl Ester,Hyaluronic Acid,Helianthus Annuus Sunflower˛ Seed Oil,Pentylene Glycol,Khaya Senegalensis Bark Extract,Maltodextrin,Linalool,Limonene,Citric Acid,Paeonia Lactiflora Root Extract,Coumarin,Sodium Benzoate,Nicotiana Benthamiana Hexapeptide 40 Sh Polypeptide 47. (260/018)",https://image-optimizer-th.production.sephora-asia.net/images/product_images/closeup_1_Product_3522930004257-Caudalie-Resveratrol-Lift-Firming-Ni_4ae2248e1a8dd55b86e3e4aa141cf31bd787e2b5_1745924317.png?o=clean-planet-aware,C:\Users\Petch\Desktop\Projectskin\skincare-ai-recomender\backend\scraper\data_products\images\sep_61e3e94b420c.jpg,sephora_th,thailand-20338-155569
https://www.sephora.co.th/products/caudalie-vinohydra-gel-moisturizer/v/60ml,VinoHydra Gel Moisturizer,CAUDALIE,moisturizer,moisturizer,,,,,"antioxidant,calming,hydrating,moisturizing",dry,"บัญชีของฉัน ลงทะเบียน|เข้าสู่ระบบ GET THE APP สาขา และ กิจกรรม จองคิวบริการ BEAUTY SERVICE ไทย ถุงชอปปิง เพลิดเพลินกับการเป็นสมาชิกบิวตี้พาส ลด 10% ทุกชิ้น ไม่มีขั้นตำ่ เมื่อชอปบนออนไลน์ครั้งแรก ใช้โค้ด WELCOME สะสมคะแนนบิ้วตี้พาสเพื่อรับของขวัญและส่วนลดต่างๆ รับฟรี 50 คะแนน เมื่อสมัครสมาชิก และสิทธิะิเศษอีกมากมาย! เข้าสู่ระบบ ลงทะเบียน FREE SHIPPING เมื่อชอปครบ ฿500 ขึ้นไป ฟรี สินค้าขนาดทดลอง ทุกการสั่งซื้อ จนกว่าสินค้าจะหมด! ใหม่ เมคอัป สกินแคร์ ดูแลเส้นผม อุปกรณ์เสริมสวย ดูแลผิวกาย น้ำหอม คลีนบิวตี้ ของขวัญ และบัตรของขวัญ แบรนด์ โปรโมชั่น Home Caudalie VinoHydra Gel Moisturizer ที่เซโฟราเท่านั้น CAUDALIE VinoHydra Gel Moisturizer 4.6 จาก 5 ดาว ค่าคะแนนเฉลี่ย Read 362 Reviews. ลิงก์หน้าเดียวกัน 4.6 (362) เขียนบทวิจารณ์ ฿1, 350.00 ขนาด: 60ml 60ml ดูขนาดทั้งหมด จำนวน: 1 2 3 4 5 6 เพิ่มในถุงช็อปปิ้ง คำอธิบาย ข้อมูลผลิตภัณฑ์ VinoHydra Gel Moisturizer เติมความชุ่มชื้นอย่างเป็นธรรมชาติให้กับผิว คุณประโยชน์ สูตรปราศจากซิลิโคน เนื้อสัมผัสเจลที่มอบความสดชื่นสูง ซึมซาบลงสู่ผิวโดยไม่ทำให้เกิดฟินิชผิวมันวาว เหมาะสำหรับผิวผสมและผิวแพ้ง่าย สัมผัสผิวนุ่มและมีชีวิตชีวาทันทีที่ใช้ มอบผลลัพธ์ผิวอย่างเห็นได้ชัด ผิวชุ่มชื้นขึ้น +84% หลังใช้ 30 นาที ข้อมูลน่ารู้ * เรียนรู้เพิ่มเติมเกี่ยวกับ Sephora’s Clean ได้ ที่นี่, รวมไปถึงรายการ ส่วนผสมที่ปลอดภัย เป็นมิตรต่อสิ่งแวดล้อม และสิ่งสำคัญที่ทำให้เป็น Clean, Planet Aware หรือ Clean + Planet Aware. ข้อสงวนสิทธิการใช้งาน + ดูคำบรรยายทั้งหมด ส่วนประกอบ Aqua/Water/Eau, Glycerin, Vitis Vinifera (Grape) Fruit Water, Isostearyl Isostearate, Octyldodecyl Myristate, Squalane, Microcrystalline Cellulose, Caprylic/Capric Triglyceride, Benzyl Alcohol, Xanthan Gum, Carbomer, Cellulose Gum, Caprylyl Glycol, Vitis Vinifera (Grape) Juice, Sodium Hyaluronate, Sodium Hydroxide, Aloe Barbadensis Leaf Juice Powder, Helianthus Annuus (Sunflower) Seed Oil, Tocopherol, Citric Acid, Dehydroacetic Acid, Sodium Phytate, Sodium Carboxymethyl Beta-Glucan, Sodium Benzoate, Potassium Sorbate, Parfum (Fragrance).(288/048) + ดูส่วนผสมทั้งหมด วิธีการใช้งาน ทาในตอนเช้าและตอนเย็นลงบนใบหน้าและคอ ใช้เดี่ยว ๆ หรือหลังทาหลังจากเซรั่มของคุณ การจัดส่ง จัดส่งไปตามที่อยู่ที่ระบุ ส่งฟรี เมื่อสั่งซื้อครบ ฿500.00 บาทขึ้นไป Standard Shipping: ฿59.00 ได้รับระหว่าง 13 Mar - 17 Mar แนะนำสำหรับคุณ CAUDALIE VinoHydra Deep Hydration Moisturizer ฿1, 350.00 CAUDALIE VinoHydra Sorbet Cream Moisturizer ฿1, 350.00 CAUDALIE VinoHydra Hyaluronic Serum ฿1, 900.00 CAUDALIE Resveratrol-Lift Firming Cashmere Cream ฿2, 650.00 CAUDALIE Resveratrol-Lift Firming Night Cream ฿2, 650.00 CAUDALIE Vinohydra Moisturizing Duo (Holiday Limited Edition) ฿1, 350.00 CAUDALIE Vinoperfect Dark Spot Correcting Glycolic Night Cream ฿2, 230.00 CAUDALIE Resveratrol-Lift Firming Cashmere Cream Refill ฿2, 200.00 CAUDALIE Premier Cru The Cream ฿4, 690.00 CAUDALIE Vinopure Skin Perfecting Matifying Fluid ฿1, 250.00","บัญชีของฉัน ลงทะเบียน|เข้าสู่ระบบ GET THE APP สาขา และ กิจกรรม จองคิวบริการ BEAUTY SERVICE ไทย ถุงชอปปิง เพลิดเพลินกับการเป็นสมาชิกบิวตี้พาส ลด 10% ทุกชิ้น ไม่มีขั้นตำ่ เมื่อชอปบนออนไลน์ครั้งแรก ใช้โค้ด WELCOME สะสมคะแนนบิ้วตี้พาสเพื่อรับของขวัญและส่วนลดต่างๆ รับฟรี 50 คะแนน เมื่อสมัครสมาชิก และสิทธิะิเศษอีกมากมาย! เข้าสู่ระบบ ลงทะเบียน FREE SHIPPING เมื่อชอปครบ ฿500 ขึ้นไป ฟรี สินค้าขนาดทดลอง ทุกการสั่งซื้อ จนกว่าสินค้าจะหมด! ใหม่ เมคอัป สกินแคร์ ดูแลเส้นผม อุปกรณ์เสริมสวย ดูแลผิวกาย น้ำหอม คลีนบิวตี้ ของขวัญ และบัตรของขวัญ แบรนด์ โปรโมชั่น Home Caudalie VinoHydra Gel Moisturizer ที่เซโฟราเท่านั้น CAUDALIE VinoHydra Gel Moisturizer 4.6 จาก 5 ดาว ค่าคะแนนเฉลี่ย Read 362 Reviews. ลิงก์หน้าเดียวกัน 4.6 (362) เขียนบทวิจารณ์ ฿1,350.00 ขนาด: 60ml 60ml ดูขนาดทั้งหมด จำนวน: 1 2 3 4 5 6 เพิ่มในถุงช็อปปิ้ง คำอธิบาย ข้อมูลผลิตภัณฑ์ VinoHydra Gel Moisturizer เติมความชุ่มชื้นอย่างเป็นธรรมชาติให้กับผิว คุณประโยชน์ สูตรปราศจากซิลิโคน เนื้อสัมผัสเจลที่มอบความสดชื่นสูง ซึมซาบลงสู่ผิวโดยไม่ทำให้เกิดฟินิชผิวมันวาว เหมาะสำหรับผิวผสมและผิวแพ้ง่าย สัมผัสผิวนุ่มและมีชีวิตชีวาทันทีที่ใช้ มอบผลลัพธ์ผิวอย่างเห็นได้ชัด ผิวชุ่มชื้นขึ้น +84% หลังใช้ 30 นาที ข้อมูลน่ารู้ * เรียนรู้เพิ่มเติมเกี่ยวกับ Sephora’s Clean ได้ ที่นี่,รวมไปถึงรายการ ส่วนผสมที่ปลอดภัย เป็นมิตรต่อสิ่งแวดล้อม และสิ่งสำคัญที่ทำให้เป็น Clean,Planet Aware หรือ Clean + Planet Aware. ข้อสงวนสิทธิการใช้งาน + ดูคำบรรยายทั้งหมด ส่วนประกอบ Aqua/Water/Eau,Glycerin,Vitis Vinifera (Grape) Fruit Water,Isostearyl Isostearate,Octyldodecyl Myristate,Squalane,Microcrystalline Cellulose,Caprylic/Capric Triglyceride,Benzyl Alcohol,Xanthan Gum,Carbomer,Cellulose Gum,Caprylyl Glycol,Vitis Vinifera (Grape) Juice,Sodium Hyaluronate,Sodium Hydroxide,Aloe Barbadensis Leaf Juice Powder,Helianthus Annuus (Sunflower) Seed Oil,Tocopherol,Citric Acid,Dehydroacetic Acid,Sodium Phytate,Sodium Carboxymethyl Beta-Glucan,Sodium Benzoate,Potassium Sorbate,Parfum (Fragrance).(288/048) + ดูส่วนผสมทั้งหมด วิธีการใช้งาน ทาในตอนเช้าและตอนเย็นลงบนใบหน้าและคอ ใช้เดี่ยว ๆ หรือหลังทาหลังจากเซรั่มของคุณ การจัดส่ง จัดส่งไปตามที่อยู่ที่ระบุ ส่งฟรี เมื่อสั่งซื้อครบ ฿500.00 บาทขึ้นไป Standard Shipping: ฿59.00 ได้รับระหว่าง 13 Mar - 17 Mar แนะนำสำหรับคุณ CAUDALIE VinoHydra Deep Hydration Moisturizer ฿1,350.00 CAUDALIE VinoHydra Sorbet Cream Moisturizer ฿1,350.00 CAUDALIE VinoHydra Hyaluronic Serum ฿1,900.00 CAUDALIE Resveratrol-Lift Firming Cashmere Cream ฿2,650.00 CAUDALIE Resveratrol-Lift Firming Night Cream ฿2,650.00 CAUDALIE Vinohydra Moisturizing Duo (Holiday Limited Edition) ฿1,350.00 CAUDALIE Vinoperfect Dark Spot Correcting Glycolic Night Cream ฿2,230.00 CAUDALIE Resveratrol-Lift Firming Cashmere Cream Refill ฿2,200.00 CAUDALIE Premier Cru The Cream ฿4,690.00 CAUDALIE Vinopure Skin Perfecting Matifying Fluid ฿1,250.00",https://image-optimizer-th.production.sephora-asia.net/images/product_images/closeup_1_Product_3522930004394-Caudalie-VinoHydra-Gel-Moisturizer-6_383a57dd0c43acc88e1e4cf29eea365104698a6b_1729061072.png?o=clean-planet-aware,C:\Users\Petch\Desktop\Projectskin\skincare-ai-recomender\backend\scraper\data_products\images\sep_5263c49d2cc1.jpg,sephora_th,thailand-37165-150017
