product_url,name,brand,ingredients_raw,ingredients_list
https://incidecoder.com/products/sisley-black-rose-cream-mask-discontinued,Sisley Black Rose Cream Mask (Discontinued),Sisley,"Water/Eau (Aqua), Butyrospermum Parkii (Shea Butter), Glycerin, Hydroxyethyl Acrylate/Sodium Acryloyldimethyl Taurate Copolymer, Squalane, Butylene Glycol, Tocopheryl Acetate, Simmondsia Chinensis (Jojoba) Seed Oil, Panthenol, Tocopheryl Acetate, Rosa Damascena Flower Oil, Glycerin, Squalane, Arginine, Panthenol","['water/eau (aqua)', 'butyrospermum parkii (shea butter)', 'glycerin', 'hydroxyethyl acrylate/sodium acryloyldimethyl taurate copolymer', 'squalane', 'butylene glycol', 'tocopheryl acetate', 'simmondsia chinensis (jojoba) seed oil', 'panthenol', 'tocopheryl acetate', 'rosa damascena flower oil', 'glycerin', 'squalane', 'arginine', 'panthenol']"
https://incidecoder.com/products/niod-flavanone-mud,NIOD Flavanone Mud,NIOD,"Aqua (Water), Montmorillonite, Kaolin, Bisabolol, Silica Cetyl Silylate, Isodecyl Neopentanoate, Panthenyl Triacetate, Glucosyl Hesperidin, Potassium Azeloyl Diglycinate, Potassium Azeloyl Diglycinate, Resveratrol, Potassium Azeloyl Diglycinate, Glycerin, Arginine, Bisabolol, Potassium Azeloyl Diglycinate, Alteromonas Ferment Extract","['aqua (water)', 'montmorillonite', 'kaolin', 'bisabolol', 'silica cetyl silylate', 'isodecyl neopentanoate', 'panthenyl triacetate', 'glucosyl hesperidin', 'potassium azeloyl diglycinate', 'potassium azeloyl diglycinate', 'resveratrol', 'potassium azeloyl diglycinate', 'glycerin', 'arginine', 'bisabolol', 'potassium azeloyl diglycinate', 'alteromonas ferment extract']"
https://incidecoder.com/products/hylamide-ha-blur,Hylamide Ha Blur,Hylamide,"Caprylyl Methicone, Aqua (Water), PEG-12 Dimethicone/PPG-20 Crosspolymer, Hexamethyldisiloxane, Polysilicone-11, Cyclopentasiloxane, Isodecyl Neopentanoate, Vinyl Dimethicone/Methicone Silsesquioxane Crosspolymer, Cyclomethicone, Tocopherol, Sodium Hyaluronate","['caprylyl methicone', 'aqua (water)', 'peg-12 dimethicone/ppg-20 crosspolymer', 'hexamethyldisiloxane', 'polysilicone-11', 'cyclopentasiloxane', 'isodecyl neopentanoate', 'vinyl dimethicone/methicone silsesquioxane crosspolymer', 'cyclomethicone', 'tocopherol', 'sodium hyaluronate']"
https://incidecoder.com/products/biologique-recherche-serum-placenta,Biologique Recherche Serum Placenta,Biologique,"Water (Aqua), Hydrolyzed Placental Protein, Phenoxyethanol, Ethylhexylglycerin, Hydrolyzed Placental Protein, Phenoxyethanol, Ethylhexylglycerin, Water (Aqua)","['water (aqua)', 'hydrolyzed placental protein', 'phenoxyethanol', 'ethylhexylglycerin', 'hydrolyzed placental protein', 'phenoxyethanol', 'ethylhexylglycerin', 'water (aqua)']"
https://incidecoder.com/products/kate-somerville-goat-milk-moisturizing-cream-discontinued,Kate Somerville Goat Milk Moisturizing Cream (Discontinued),Kate,"Water, Ethylhexyl Palmitate, Myristyl Myristate, Glyceryl Stearate, Peg-100 Stearate, Cetearyl Ethylhexanoate, Decyl Oleate, Glycerin, Propanediol, Persea Gratissima Oil, Vitis Vinifera Seed Oil, Rosmarinus Officinalis Leaf Extract, Tocopheryl Acetate, Tocopherol, Lactic Acid, Glycerin, Hamamelis Virginiana Flower Water, Aloe Barbadensis Leaf Juice Powder, Rosmarinus Officinalis Leaf Extract","['water', 'ethylhexyl palmitate', 'myristyl myristate', 'glyceryl stearate', 'peg-100 stearate', 'cetearyl ethylhexanoate', 'decyl oleate', 'glycerin', 'propanediol', 'persea gratissima oil', 'vitis vinifera seed oil', 'rosmarinus officinalis leaf extract', 'tocopheryl acetate', 'tocopherol', 'lactic acid', 'glycerin', 'hamamelis virginiana flower water', 'aloe barbadensis leaf juice powder', 'rosmarinus officinalis leaf extract']"
https://incidecoder.com/products/the-ordinary-marine-hyaluronics-discontinued,The Ordinary Marine Hyaluronics (Discontinued),The,"Aqua (Water), Glycerin, Algae Extract, Pseudoalteromonas Exopolysaccharides, Pseudoalteromonas Ferment Extract, Ahnfeltia Concinna Extract, Arginine, Glycine, Alanine, Salicylic Acid, Salicylic Acid, Glycerin, Arginine, Glycine, Alanine, Serine, Valine, Isoleucine, Proline, Threonine, Histidine, Phenylalanine, Aspartic Acid, Pca, Sodium Pca, Pseudoalteromonas Ferment Extract, Salicylic Acid","['aqua (water)', 'glycerin', 'algae extract', 'pseudoalteromonas exopolysaccharides', 'pseudoalteromonas ferment extract', 'ahnfeltia concinna extract', 'arginine', 'glycine', 'alanine', 'salicylic acid', 'salicylic acid', 'glycerin', 'arginine', 'glycine', 'alanine', 'serine', 'valine', 'isoleucine', 'proline', 'threonine', 'histidine', 'phenylalanine', 'aspartic acid', 'pca', 'sodium pca', 'pseudoalteromonas ferment extract', 'salicylic acid']"
https://incidecoder.com/products/thank-you-farmer-sun-project-water-sun-cream-spf50-discontinued,Thank You Farmer Sun Project Water Sun Cream Spf 50 (Discontinued),Thank,"Water, Ethylhexyl Methoxycinnamate, Homosalate, Ethylhexyl Salicylate, Diethylamino Hydroxybenzoyl Hexyl Benzoate, Octocrylene, C12-15 Alkyl Benzoate, Butylene Glycol, Cyclomethicone, Centella Asiatica Extract, Portulaca Oleracea Extract, Plukenetia Volubilis Seed Oil, Sodium Hyaluronate, Helianthus Annuus (Sunflower) Seed Oil Unsaponifiables, Viscum Album (Mistletoe) Leaf Extract, Centella Asiatica Extract, Portulaca Oleracea Extract, Aloe Barbadensis Leaf Extract, Helianthus Annuus (Sunflower) Seed Oil Unsaponifiables, Ethylhexyl Methoxycinnamate, Homosalate, Ethylhexyl Salicylate, Diethylamino Hydroxybenzoyl Hexyl Benzoate, Octocrylene, Titanium Dioxide","['water', 'ethylhexyl methoxycinnamate', 'homosalate', 'ethylhexyl salicylate', 'diethylamino hydroxybenzoyl hexyl benzoate', 'octocrylene', 'c12-15 alkyl benzoate', 'butylene glycol', 'cyclomethicone', 'centella asiatica extract', 'portulaca oleracea extract', 'plukenetia volubilis seed oil', 'sodium hyaluronate', 'helianthus annuus (sunflower) seed oil unsaponifiables', 'viscum album (mistletoe) leaf extract', 'centella asiatica extract', 'portulaca oleracea extract', 'aloe barbadensis leaf extract', 'helianthus annuus (sunflower) seed oil unsaponifiables', 'ethylhexyl methoxycinnamate', 'homosalate', 'ethylhexyl salicylate', 'diethylamino hydroxybenzoyl hexyl benzoate', 'octocrylene', 'titanium dioxide']"
https://incidecoder.com/products/glossier-super-glow-discontinued,Glossier Super Glow (Discontinued),Glossier,"Water/Aqua/Eau, Glycereth-26, Propanediol, Aminopropyl Ascorbyl Phosphate, Magnesium Pca, Ethylhexylglycerin, Phenoxyethanol, Aminopropyl Ascorbyl Phosphate, Aminopropyl Ascorbyl Phosphate","['water/aqua/eau', 'glycereth-26', 'propanediol', 'aminopropyl ascorbyl phosphate', 'magnesium pca', 'ethylhexylglycerin', 'phenoxyethanol', 'aminopropyl ascorbyl phosphate', 'aminopropyl ascorbyl phosphate']"
https://incidecoder.com/products/osea-advanced-protection-cream,OSEA Advanced Protection Cream,OSEA,"Aqua, *Algae Extract, Dipalmitoyl Hydroxyproline, Coco Caprylate/Caprate, Cetearyl Glucoside, Squalane (Olive), Glycerin, *Aloe Barbadensis (Aloe Vera) Leaf Juice, *Macadamia Ternifolia (Macadamia) Seed Oil, *Vitis Vinifera Seed (Grapeseed) Oil, Tocopherol (Vitamin E), *Persea Gratissima (Avocado) Oil, *Calendula Officinalis Flower Extract, Potassium Ascorbyl Tocopheryl Phosphate (Natural Vitamin C), Squalane (Olive), Glycerin, Glycine, *Aloe Barbadensis (Aloe Vera) Leaf Juice, *Calendula Officinalis Flower Extract, *Anthemis Nobilis Flower (Chamomile) Extract","['aqua', '*algae extract', 'dipalmitoyl hydroxyproline', 'coco caprylate/caprate', 'cetearyl glucoside', 'squalane (olive)', 'glycerin', '*aloe barbadensis (aloe vera) leaf juice', '*macadamia ternifolia (macadamia) seed oil', '*vitis vinifera seed (grapeseed) oil', 'tocopherol (vitamin e)', '*persea gratissima (avocado) oil', '*calendula officinalis flower extract', 'potassium ascorbyl tocopheryl phosphate (natural vitamin c)', 'squalane (olive)', 'glycerin', 'glycine', '*aloe barbadensis (aloe vera) leaf juice', '*calendula officinalis flower extract', '*anthemis nobilis flower (chamomile) extract']"
https://incidecoder.com/products/la-roche-posay-anthelios-xl-spf-50-dry-touch-gel-cream-anti-shine,La Roche-Posay Anthelios Xl Spf 50+ Dry Touch Gel-Cream Anti-Shine,La,"Aqua / Water, Homosalate, Silica, Octocrylene, Ethylhexyl Salicylate, Butyl Methoxydibenzoylmethane, Ethylhexyl Triazone, Bis-Ethylhexyloxyphenol Methoxyphenyl Triazine, Drometrizole Trisiloxane, Zinc Gluconate, Scutellaria Baicalensis Extract / Scutellaria Baicalensis Root Extract, Tocopherol, Glycerin, Scutellaria Baicalensis Extract / Scutellaria Baicalensis Root Extract, Zinc Gluconate, Homosalate, Octocrylene, Ethylhexyl Salicylate, Butyl Methoxydibenzoylmethane, Ethylhexyl Triazone, Bis-Ethylhexyloxyphenol Methoxyphenyl Triazine, Drometrizole Trisiloxane, Terephthalylidene Dicamphor Sulfonic Acid, Titanium Dioxide","['aqua / water', 'homosalate', 'silica', 'octocrylene', 'ethylhexyl salicylate', 'butyl methoxydibenzoylmethane', 'ethylhexyl triazone', 'bis-ethylhexyloxyphenol methoxyphenyl triazine', 'drometrizole trisiloxane', 'zinc gluconate', 'scutellaria baicalensis extract / scutellaria baicalensis root extract', 'tocopherol', 'glycerin', 'scutellaria baicalensis extract / scutellaria baicalensis root extract', 'zinc gluconate', 'homosalate', 'octocrylene', 'ethylhexyl salicylate', 'butyl methoxydibenzoylmethane', 'ethylhexyl triazone', 'bis-ethylhexyloxyphenol methoxyphenyl triazine', 'drometrizole trisiloxane', 'terephthalylidene dicamphor sulfonic acid', 'titanium dioxide']"
https://incidecoder.com/products/paulas-choice-resist-super-light-wrinkle-defense-spf-30,Paula's Choice Resist Super-Light Wrinkle Defense Spf 30,Paula's,"Zinc Oxide (13%), Water, Cyclopentasiloxane, Peg-12 Dimethicone, Peg/Ppg-18/18 Dimethicone, Lauroyl Lysine, Sodium Chloride, Trihydroxystearin, Dimethicone Crosspolymer, Resveratrol, Quercetin, Epigallocatechin Gallate, Tocopheryl Acetate, Tetrahexyldecyl Ascorbate, Haematococcus Pluvialis Extract, Adenosine, Tetrahexyldecyl Ascorbate, Quercetin, Epigallocatechin Gallate, Bisabolol, Salix Alba (Willow) Bark Extract, Zinc Oxide (13%)","['zinc oxide (13%)', 'water', 'cyclopentasiloxane', 'peg-12 dimethicone', 'peg/ppg-18/18 dimethicone', 'lauroyl lysine', 'sodium chloride', 'trihydroxystearin', 'dimethicone crosspolymer', 'resveratrol', 'quercetin', 'epigallocatechin gallate', 'tocopheryl acetate', 'tetrahexyldecyl ascorbate', 'haematococcus pluvialis extract', 'adenosine', 'tetrahexyldecyl ascorbate', 'quercetin', 'epigallocatechin gallate', 'bisabolol', 'salix alba (willow) bark extract', 'zinc oxide (13%)']"
https://incidecoder.com/products/etude-house-soonjung-hydro-barrier-cream-discontinued,Etude House Soon Jung Hydro Barrier Cream (Discontinued),Etude,"Water (67.3%), Glycerin 10.0%, Propanediol (10%), Phenyl Trimethicone, Panthenol, Methyl Trimethicone, Hydrogenated Poly(C6-14 Olefin), 1,2-Hexanediol, Polymethylsilsesquioxane, Lauric Acid, Madecassoside, Scutellaria Baicalensis Root Extract, Tocopherol, Glycerin 10.0%, Panthenol, Madecassoside, Scutellaria Baicalensis Root Extract","['water (67.3%)', 'glycerin 10.0%', 'propanediol (10%)', 'phenyl trimethicone', 'panthenol', 'methyl trimethicone', 'hydrogenated poly(c6-14 olefin)', '1', '2-hexanediol', 'polymethylsilsesquioxane', 'lauric acid', 'madecassoside', 'scutellaria baicalensis root extract', 'tocopherol', 'glycerin 10.0%', 'panthenol', 'madecassoside', 'scutellaria baicalensis root extract']"
https://incidecoder.com/products/biologique-recherche-lotion-p50-1970,Biologique Recherche Lotion P50 1970,Biologique,"Water (Aqua), Glycerin, Phenol, Niacinamide, Vinegar (Acetum), Ethoxydiglycol, Magnesium Chloride, Lactic Acid, Arctium Lappa Root (Burdock Root) Extract, Niacinamide, Salicylic Acid, Sulfur, Arctium Lappa Root (Burdock Root) Extract, Niacinamide, Lactic Acid, Salicylic Acid, Niacinamide, Glycerin, Arctium Lappa Root (Burdock Root) Extract, Salicylic Acid","['water (aqua)', 'glycerin', 'phenol', 'niacinamide', 'vinegar (acetum)', 'ethoxydiglycol', 'magnesium chloride', 'lactic acid', 'arctium lappa root (burdock root) extract', 'niacinamide', 'salicylic acid', 'sulfur', 'arctium lappa root (burdock root) extract', 'niacinamide', 'lactic acid', 'salicylic acid', 'niacinamide', 'glycerin', 'arctium lappa root (burdock root) extract', 'salicylic acid']"
https://incidecoder.com/products/votary-cleansing-oil-rose-geranium-and-apricot,Votary Cleansing Oil – Rose Geranium And Apricot,Votary,"Helianthus Annuus (Sunflower) Seed Oil, Prunus Armeniaca (Apricot) Kernel Oil, Simmondsia Chinensis (Jojoba) Seed Oil, Vitis Vinifera (Grape) Seed Oil, Tocopherol, Pelargonium Graveolens (Rose Geranium) Flower Oil, Anthemis Nobilis (Chamomile) Flower Oil, Limonene*, Citronellol*, Vitis Vinifera (Grape) Seed Oil, Tocopherol, Anthemis Nobilis (Chamomile) Flower Oil","['helianthus annuus (sunflower) seed oil', 'prunus armeniaca (apricot) kernel oil', 'simmondsia chinensis (jojoba) seed oil', 'vitis vinifera (grape) seed oil', 'tocopherol', 'pelargonium graveolens (rose geranium) flower oil', 'anthemis nobilis (chamomile) flower oil', 'limonene*', 'citronellol*', 'vitis vinifera (grape) seed oil', 'tocopherol', 'anthemis nobilis (chamomile) flower oil']"
https://incidecoder.com/products/dermasil-labs-facial-cleanser-for-acne-prone-skin,Dermasil LABS Facial Cleanser For Acne Prone Skin,Dermasil,"Water, Sodium Laureth Sulfate, Cocamidopropyl Betaine, Glycerin, Sodium Chloride, Sodium Lauroamphoacetate, Glycol Distearate, Glyceryl Laurate, PEG-80 Sorbitan Laurate, Salicylic Acid, Azelaic Acid, Melaleuca Alternifolia Leaf Oil, Hamamelis Virginiana Extract, Melaleuca Alternifolia Leaf Oil, Salicylic Acid, Glycolic Acid, Glycerin, Salicylic Acid, Hamamelis Virginiana Extract, Azelaic Acid, Melaleuca Alternifolia Leaf Oil","['water', 'sodium laureth sulfate', 'cocamidopropyl betaine', 'glycerin', 'sodium chloride', 'sodium lauroamphoacetate', 'glycol distearate', 'glyceryl laurate', 'peg-80 sorbitan laurate', 'salicylic acid', 'azelaic acid', 'melaleuca alternifolia leaf oil', 'hamamelis virginiana extract', 'melaleuca alternifolia leaf oil', 'salicylic acid', 'glycolic acid', 'glycerin', 'salicylic acid', 'hamamelis virginiana extract', 'azelaic acid', 'melaleuca alternifolia leaf oil']"
https://incidecoder.com/products/dermasil-labs-melon-jelly-cleanser,Dermasil LABS Melon Jelly Cleanser,Dermasil,"Water, Cocamidopropyl Betaine, Sodium C14-16 Olefin Sulfonate, Decyl Glucoside, Glycerin, Sodium Chloride, Sodium Lauroamphoacetate, Glycol Distearate, Sodium Benzoate, Niacinamide, Niacinamide, Niacinamide, Glycerin","['water', 'cocamidopropyl betaine', 'sodium c14-16 olefin sulfonate', 'decyl glucoside', 'glycerin', 'sodium chloride', 'sodium lauroamphoacetate', 'glycol distearate', 'sodium benzoate', 'niacinamide', 'niacinamide', 'niacinamide', 'glycerin']"
https://incidecoder.com/products/sanitas-skincare-nature-moisture-factor-serum,Sanitas Skincare Nature Moisture Factor Serum,Sanitas,"Squalane, Tocopheryl Acetate (Vitamin E), Ethyl Linoleate (Vitamin F), Isosorbide Dicaprylate, Ubiquinone (Coq10), Cholecalciferol (Vitamin D), Helianthus Annuus (Sunflower) Seed Oil, Tocopheryl Acetate (Vitamin E), Ubiquinone (Coq10), Isosorbide Dicaprylate, Squalane","['squalane', 'tocopheryl acetate (vitamin e)', 'ethyl linoleate (vitamin f)', 'isosorbide dicaprylate', 'ubiquinone (coq10)', 'cholecalciferol (vitamin d)', 'helianthus annuus (sunflower) seed oil', 'tocopheryl acetate (vitamin e)', 'ubiquinone (coq10)', 'isosorbide dicaprylate', 'squalane']"
https://incidecoder.com/products/luseta-beauty-hyaluronic-acid-moisturizing-shampoo,Luseta Beauty Hyaluronic Acid Moisturizing Shampoo,Luseta,"Water, Cocamidopropyl Betaine, Sodium C14-16 Olefin Sulfonate, Sodium Cocoyl Isethionate, Disodium Laureth Sulfosuccinate, Cocamide MEA, Dimethicone, Sodium Chloride, Glycol Distearate, Argania Spinosa Kernel Oil, Persea Gratissima (Avocado) Oil, Hyaluronic Acid, Panthenol, Aloe Barbadensis Leaf Juice Powder","['water', 'cocamidopropyl betaine', 'sodium c14-16 olefin sulfonate', 'sodium cocoyl isethionate', 'disodium laureth sulfosuccinate', 'cocamide mea', 'dimethicone', 'sodium chloride', 'glycol distearate', 'argania spinosa kernel oil', 'persea gratissima (avocado) oil', 'hyaluronic acid', 'panthenol', 'aloe barbadensis leaf juice powder']"
https://incidecoder.com/products/anua-matte-but-glow-cover-beige,Anua Matte But Glow Cover Beige,Anua,"Water, Zinc Oxide (Ci 77947), Glycerin, Butyloctyl Salicylate, Methyl Trimethicone, Titanium Dioxide (Ci 77891), Isononyl Isononanoate, Isododecane, Propylheptyl Caprylate, Niacinamide, Tocopherol, Madecassoside, Niacinamide, Niacinamide, Glycerin, Ceramide NP, Madecassoside, Zinc Oxide (Ci 77947)","['water', 'zinc oxide (ci 77947)', 'glycerin', 'butyloctyl salicylate', 'methyl trimethicone', 'titanium dioxide (ci 77891)', 'isononyl isononanoate', 'isododecane', 'propylheptyl caprylate', 'niacinamide', 'tocopherol', 'madecassoside', 'niacinamide', 'niacinamide', 'glycerin', 'ceramide np', 'madecassoside', 'zinc oxide (ci 77947)']"
https://incidecoder.com/products/yepoda-skinject-effect,Yepoda Skinject Effect,Yepoda,"Oryza Sativa (Rice) Bran Water, Propanediol, Glycerin, Calcium Aluminum Borosilicate, 1,2-Hexanediol, Butylene Glycol, Sodium Dna, Lactobacillus Ferment Lysate, Hyaluronic Acid, Glycerin, Hyaluronic Acid, Sodium Hyaluronate","['oryza sativa (rice) bran water', 'propanediol', 'glycerin', 'calcium aluminum borosilicate', '1', '2-hexanediol', 'butylene glycol', 'sodium dna', 'lactobacillus ferment lysate', 'hyaluronic acid', 'glycerin', 'hyaluronic acid', 'sodium hyaluronate']"
https://incidecoder.com/products/centellian24-madeca-matcha-toning-peeling-gel,Centellian24 Madeca Matcha Toning Peeling Gel,Centellian24,"Water, Dipropylene Glycol, Cellulose, Isostearamidopropyl Ethyldimonium Ethosulfate, Propylene Glycol, Glycerin, 1,2-Hexanediol, Acrylates/C10-30 Alkyl Acrylate Crosspolymer, Carbomer, Lauric Acid, Portulaca Oleracea Extract, Vitis Vinifera (Grape) Seed Extract, Epigallocatechin Gallate, Kojic Acid, Centella Asiatica Extract, Asiaticoside, Hamamelis Virginiana (Witch Hazel) Extract, Vitis Vinifera (Grape) Fruit Extract, Polygonum Cuspidatum Root Extract, Camellia Sinensis Leaf Extract (0.6 Ppb), Capryloyl Salicylic Acid, Gluconolactone, Tartaric Acid, Lactic Acid, Glycolic Acid, Kojic Acid, Glycerin, Ceramide NP, Sodium Hyaluronate, Allantoin, Portulaca Oleracea Extract, Epigallocatechin Gallate, Centella Asiatica Extract, Hamamelis Virginiana (Witch Hazel) Extract, Vitis Vinifera (Grape) Fruit Extract, Camellia Sinensis Leaf Extract (0.6 Ppb)","['water', 'dipropylene glycol', 'cellulose', 'isostearamidopropyl ethyldimonium ethosulfate', 'propylene glycol', 'glycerin', '1', '2-hexanediol', 'acrylates/c10-30 alkyl acrylate crosspolymer', 'carbomer', 'lauric acid', 'portulaca oleracea extract', 'vitis vinifera (grape) seed extract', 'epigallocatechin gallate', 'kojic acid', 'centella asiatica extract', 'asiaticoside', 'hamamelis virginiana (witch hazel) extract', 'vitis vinifera (grape) fruit extract', 'polygonum cuspidatum root extract', 'camellia sinensis leaf extract (0.6 ppb)', 'capryloyl salicylic acid', 'gluconolactone', 'tartaric acid', 'lactic acid', 'glycolic acid', 'kojic acid', 'glycerin', 'ceramide np', 'sodium hyaluronate', 'allantoin', 'portulaca oleracea extract', 'epigallocatechin gallate', 'centella asiatica extract', 'hamamelis virginiana (witch hazel) extract', 'vitis vinifera (grape) fruit extract', 'camellia sinensis leaf extract (0.6 ppb)']"
https://incidecoder.com/products/centellian24-madeca-matcha-cleansing-oil,Centellian24 Madeca Matcha Cleansing Oil,Centellian24,"Cetyl Ethylhexanoate, Glycerin, Polyglyceryl-10 Diisostearate, Water, Butylene Glycol, Polyglyceryl-6 Dicaprate, Olea Europaea (Olive) Fruit Oil, Camellia Sinensis Leaf Water, Fragrance, Niacinamide, Olea Europaea (Olive) Fruit Oil, Vitis Vinifera (Grape) Seed Oil, Asiaticoside, Tocopherol, Epigallocatechin Gallate, Argania Spinosa Kernel Oil, Centella Asiatica Leaf Extract, Vitis Vinifera (Grape) Fruit Extract, Polygonum Cuspidatum Root Extract, Camellia Sinensis Leaf Extract, Extract Centella Asiatica, Madecassoside, Niacinamide, Capryloyl Salicylic Acid, Lactic Acid, Glycolic Acid, Niacinamide, Glycerin, Epigallocatechin Gallate, Hamamelis Virginiana (Witch Hazel) Water, Centella Asiatica Leaf Extract, Vitis Vinifera (Grape) Fruit Extract, Camellia Sinensis Leaf Extract, Extract Centella Asiatica, Madecassoside","['cetyl ethylhexanoate', 'glycerin', 'polyglyceryl-10 diisostearate', 'water', 'butylene glycol', 'polyglyceryl-6 dicaprate', 'olea europaea (olive) fruit oil', 'camellia sinensis leaf water', 'fragrance', 'niacinamide', 'olea europaea (olive) fruit oil', 'vitis vinifera (grape) seed oil', 'asiaticoside', 'tocopherol', 'epigallocatechin gallate', 'argania spinosa kernel oil', 'centella asiatica leaf extract', 'vitis vinifera (grape) fruit extract', 'polygonum cuspidatum root extract', 'camellia sinensis leaf extract', 'extract centella asiatica', 'madecassoside', 'niacinamide', 'capryloyl salicylic acid', 'lactic acid', 'glycolic acid', 'niacinamide', 'glycerin', 'epigallocatechin gallate', 'hamamelis virginiana (witch hazel) water', 'centella asiatica leaf extract', 'vitis vinifera (grape) fruit extract', 'camellia sinensis leaf extract', 'extract centella asiatica', 'madecassoside']"
https://incidecoder.com/products/moody-milky-toner-hello-kitty-addition,Moody Milky Toner- Hello Kitty Addition,Moody,"Aqua (Water), Glycerin, Salix Alba (Willow) Bark Extract, Mandelic Acid, Succinic Acid, Tartaric Acid, Propylene Glycol, Panthenol (Provitamin B5), Limnanthes Alba (Meadowfoam) Seed Oil, Argania Spinosa (Argan) Kernel Oil, Mandelic Acid, Tartaric Acid, Glycerin, Salix Alba (Willow) Bark Extract, Panthenol (Provitamin B5)","['aqua (water)', 'glycerin', 'salix alba (willow) bark extract', 'mandelic acid', 'succinic acid', 'tartaric acid', 'propylene glycol', 'panthenol (provitamin b5)', 'limnanthes alba (meadowfoam) seed oil', 'argania spinosa (argan) kernel oil', 'mandelic acid', 'tartaric acid', 'glycerin', 'salix alba (willow) bark extract', 'panthenol (provitamin b5)']"
https://incidecoder.com/products/trueve-vita-c-glow-brightening-serum,Trueve Vita C Glow Brightening Serum,Trueve,"Aqua, Tetrahexyldecyl Ascorbate, Glycerin, Caprylic/Capric Triglyceride, Helianthus Annuus Seed Oil, Methylpropanediol, Trimethylpentanediol/Adipic Acid Copolymer, 3-0-Ethyl Ascorbic Acid, Niacinamide, Niacinamide, Phytosphingosine, Tetrahexyldecyl Ascorbate, 3-0-Ethyl Ascorbic Acid, Tocopherol, Centella Asiatica Leaf Extract, Sodium Hyaluronate Crosspolymer, Sodium Bisulfite, Niacinamide, Acetyl Tetrapeptide-2, Phytosphingosine, Tetrahexyldecyl Ascorbate, 3-0-Ethyl Ascorbic Acid, Niacinamide, Glycerin, Ceramide NP, Hyaluronic Acid, Sodium Hyaluronate, Sodium Hyaluronate Crosspolymer, Cholesterol, Phytosphingosine, Lactobacillus Ferment, Centella Asiatica Leaf Extract, Panthenol, Allantoin","['aqua', 'tetrahexyldecyl ascorbate', 'glycerin', 'caprylic/capric triglyceride', 'helianthus annuus seed oil', 'methylpropanediol', 'trimethylpentanediol/adipic acid copolymer', '3-0-ethyl ascorbic acid', 'niacinamide', 'niacinamide', 'phytosphingosine', 'tetrahexyldecyl ascorbate', '3-0-ethyl ascorbic acid', 'tocopherol', 'centella asiatica leaf extract', 'sodium hyaluronate crosspolymer', 'sodium bisulfite', 'niacinamide', 'acetyl tetrapeptide-2', 'phytosphingosine', 'tetrahexyldecyl ascorbate', '3-0-ethyl ascorbic acid', 'niacinamide', 'glycerin', 'ceramide np', 'hyaluronic acid', 'sodium hyaluronate', 'sodium hyaluronate crosspolymer', 'cholesterol', 'phytosphingosine', 'lactobacillus ferment', 'centella asiatica leaf extract', 'panthenol', 'allantoin']"
https://incidecoder.com/products/dermaplus-soothe-body-wash,Dermaplus Soothe Body Wash,Dermaplus,"Water, Sodium Laureth Sulfate, Cocamidopropyl Betaine, Sodium Chloride, Glycerin, Aloe Barbadensis Leaf Extract, Chamomilla Recutita (Matricaria) Flower Extract, Calendula Officinalis Flower Extract, PEG-7 Glyceryl Cocoate, Chamomilla Recutita (Matricaria) Flower Extract, Calendula Officinalis Flower Extract, Glycerin, Aloe Barbadensis Leaf Extract, Chamomilla Recutita (Matricaria) Flower Extract, Calendula Officinalis Flower Extract","['water', 'sodium laureth sulfate', 'cocamidopropyl betaine', 'sodium chloride', 'glycerin', 'aloe barbadensis leaf extract', 'chamomilla recutita (matricaria) flower extract', 'calendula officinalis flower extract', 'peg-7 glyceryl cocoate', 'chamomilla recutita (matricaria) flower extract', 'calendula officinalis flower extract', 'glycerin', 'aloe barbadensis leaf extract', 'chamomilla recutita (matricaria) flower extract', 'calendula officinalis flower extract']"
