product_url,name,brand,ingredients_raw,ingredients_list
https://incidecoder.com/products/stratia-liquid-gold,Stratia Lipid Gold,Stratia,"Water (Aqua), Propylene Glycol, Ethoxydiglycol, Niacinamide, Polyglyceryl-3 Methylglucose Distearate, Rosa Mosqueta (Rose) Hip Oil, Hippophae Rhamnoides (Sea Buckthorn) Seed Oil, Hippophae Rhamnoides (Sea Buckthorn) Fruit Oil, Panthenol, Niacinamide, Phytosphingosine, Rosa Mosqueta (Rose) Hip Oil, Hippophae Rhamnoides (Sea Buckthorn) Fruit Oil, Tocopherol, Camellia Sinensis Leaf Extract, Niacinamide, Phytosphingosine, Niacinamide, Glycerin, Squalane (Olive-Derived), Ceramide NP, Ceramide AP, Ceramide Eop, Phytosphingosine, Cholesterol, Sodium Hyaluronate, Panthenol, Camellia Sinensis Leaf Extract","['water (aqua)', 'propylene glycol', 'ethoxydiglycol', 'niacinamide', 'polyglyceryl-3 methylglucose distearate', 'rosa mosqueta (rose) hip oil', 'hippophae rhamnoides (sea buckthorn) seed oil', 'hippophae rhamnoides (sea buckthorn) fruit oil', 'panthenol', 'niacinamide', 'phytosphingosine', 'rosa mosqueta (rose) hip oil', 'hippophae rhamnoides (sea buckthorn) fruit oil', 'tocopherol', 'camellia sinensis leaf extract', 'niacinamide', 'phytosphingosine', 'niacinamide', 'glycerin', 'squalane (olive-derived)', 'ceramide np', 'ceramide ap', 'ceramide eop', 'phytosphingosine', 'cholesterol', 'sodium hyaluronate', 'panthenol', 'camellia sinensis leaf extract']"
https://incidecoder.com/products/dcl-c-scape-high-potency-night-booster-30,DCL C Scape High Potency Night Booster 30,DCL,"Isohexadecane, Ascorbic Acid 30.0%, Butylene/Ethylene/Styrene Copolymer, Ethylene/Propylene/Styrene Copolymer, Isononyl Isononanoate, Tetrahexyldecyl Ascorbate, Tocopheryl Acetate, Citrus Grandis (Grapefruit) Peel Oil, Citrus Aurantium Amara (Bitter Orange) Peel Oil, Ascorbic Acid 30.0%, Tetrahexyldecyl Ascorbate, Tocopheryl Acetate, Ubiquinone, Ascorbic Acid 30.0%, Tetrahexyldecyl Ascorbate, Squalane","['isohexadecane', 'ascorbic acid 30.0%', 'butylene/ethylene/styrene copolymer', 'ethylene/propylene/styrene copolymer', 'isononyl isononanoate', 'tetrahexyldecyl ascorbate', 'tocopheryl acetate', 'citrus grandis (grapefruit) peel oil', 'citrus aurantium amara (bitter orange) peel oil', 'ascorbic acid 30.0%', 'tetrahexyldecyl ascorbate', 'tocopheryl acetate', 'ubiquinone', 'ascorbic acid 30.0%', 'tetrahexyldecyl ascorbate', 'squalane']"
https://incidecoder.com/products/hada-labo-gokujyun-premium-hyaluronic-acid-lotion,Hada Labo Gokujyun Premium Hyaluronic Acid Lotion,Hada,"Water, Butylene Glycol, Glycerin, Ppg-10 Methyl Glucose Ether, Hydroxyethyl Urea, Sodium Acetylated Hyaluronate (Super Hyaluronic Acid), Sodium Hyaluronate, Hydrolyzed Hyaluronic Acid (Nano Hyaluronic Acid), Hydroxypropyltrimonium Hyaluronate (Skin Absorbent Type Hyaluronic Acid), Sodium Hyaluronate Crosspolymer (3D Hyaluronic Acid), Glycerin, Sodium Hyaluronate, Sodium Hyaluronate Crosspolymer (3D Hyaluronic Acid), Diglycerin","['water', 'butylene glycol', 'glycerin', 'ppg-10 methyl glucose ether', 'hydroxyethyl urea', 'sodium acetylated hyaluronate (super hyaluronic acid)', 'sodium hyaluronate', 'hydrolyzed hyaluronic acid (nano hyaluronic acid)', 'hydroxypropyltrimonium hyaluronate (skin absorbent type hyaluronic acid)', 'sodium hyaluronate crosspolymer (3d hyaluronic acid)', 'glycerin', 'sodium hyaluronate', 'sodium hyaluronate crosspolymer (3d hyaluronic acid)', 'diglycerin']"
https://incidecoder.com/products/hylamide-booster-glow-discontinued,Hylamide Booster;Glow (Discontinued),Hylamide,"Aqua (Water), Erythrulose, Glycerin, Ppg-26-Buteth-26, Propanediol, Acetyl Hexapeptide-1, Dextran, Ethoxydiglycol, Dimethyl Isosorbide, Citrullus Lanatus (Watermelon) Fruit Extract, Polypodium Vulgare Rhizome Extract, Glycerin, Phospholipids","['aqua (water)', 'erythrulose', 'glycerin', 'ppg-26-buteth-26', 'propanediol', 'acetyl hexapeptide-1', 'dextran', 'ethoxydiglycol', 'dimethyl isosorbide', 'citrullus lanatus (watermelon) fruit extract', 'polypodium vulgare rhizome extract', 'glycerin', 'phospholipids']"
https://incidecoder.com/products/the-ordinary-multi-peptide-serum-for-hair-density,The Ordinary Multi-Peptide Serum For Hair Density,The,"Aqua (Water), Propanediol, Butylene Glycol, Glycerin, Caffeine, Biotinoyl Tripeptide-1, Acetyl Tetrapeptide-3, Larix Europaea Wood Extract, Pisum Sativum Extract, Caffeine, Scutellaria Baicalensis Root Extract, Camellia Sinensis Leaf Extract, Apigenin, Biotinoyl Tripeptide-1, Acetyl Tetrapeptide-3, Lactic Acid, Gluconolactone, Glycerin, Arginine, Glycine, Scutellaria Baicalensis Root Extract, Camellia Sinensis Leaf Extract, Zinc Chloride","['aqua (water)', 'propanediol', 'butylene glycol', 'glycerin', 'caffeine', 'biotinoyl tripeptide-1', 'acetyl tetrapeptide-3', 'larix europaea wood extract', 'pisum sativum extract', 'caffeine', 'scutellaria baicalensis root extract', 'camellia sinensis leaf extract', 'apigenin', 'biotinoyl tripeptide-1', 'acetyl tetrapeptide-3', 'lactic acid', 'gluconolactone', 'glycerin', 'arginine', 'glycine', 'scutellaria baicalensis root extract', 'camellia sinensis leaf extract', 'zinc chloride']"
https://incidecoder.com/products/vichy-mineral-89,Vichy Mineral 89,Vichy,"Aqua/Water, PEG/PPG/Polybutylene Glycol-8/5/3 Glycerin, Glycerin, Butylene Glycol, Methyl Gluceth-20, Carbomer, Sodium Hyaluronate, Phenoxyethanol, Caprylyl Glycol, Glycerin, Sodium Hyaluronate, Biosaccharide Gum-1","['aqua/water', 'peg/ppg/polybutylene glycol-8/5/3 glycerin', 'glycerin', 'butylene glycol', 'methyl gluceth-20', 'carbomer', 'sodium hyaluronate', 'phenoxyethanol', 'caprylyl glycol', 'glycerin', 'sodium hyaluronate', 'biosaccharide gum-1']"
https://incidecoder.com/products/the-ordinary-vitamin-c-suspension-30-in-silicone,The Ordinary Vitamin C Suspension 30% In Silicone,The,"Dimethicone, Ascorbic Acid 30.0%, Polysilicone-11, Peg-10 Dimethicone, Ascorbic Acid 30.0%, Ascorbic Acid 30.0%","['dimethicone', 'ascorbic acid 30.0%', 'polysilicone-11', 'peg-10 dimethicone', 'ascorbic acid 30.0%', 'ascorbic acid 30.0%']"
https://incidecoder.com/products/la-roche-posay-anthelios-anti-imperfections-gel-spf-50,La Roche-Posay Anthelios Anti Imperfections Gel Spf 50+,La,"Aqua/Water, Homosalate, Silica, Octocrylene, Ethylhexyl Salicylate, Butyl Methoxydibenzoylmethane, Ethylhexyl Triazone, Bis-Ethylhexyloxyphenol Methoxyphenyl Triazine, Niacinamide, Niacinamide, Salicylic Acid, Zinc Pca, Tocopherol, Niacinamide, Salicylic Acid, Niacinamide, Glycerin, Salicylic Acid, Homosalate, Octocrylene, Ethylhexyl Salicylate, Butyl Methoxydibenzoylmethane, Ethylhexyl Triazone, Bis-Ethylhexyloxyphenol Methoxyphenyl Triazine, Drometrizole Trisiloxane, Terephthalylidene Dicamphor Sulfonic Acid, Titanium Dioxide (Nano] / Titanium Dioxide","['aqua/water', 'homosalate', 'silica', 'octocrylene', 'ethylhexyl salicylate', 'butyl methoxydibenzoylmethane', 'ethylhexyl triazone', 'bis-ethylhexyloxyphenol methoxyphenyl triazine', 'niacinamide', 'niacinamide', 'salicylic acid', 'zinc pca', 'tocopherol', 'niacinamide', 'salicylic acid', 'niacinamide', 'glycerin', 'salicylic acid', 'homosalate', 'octocrylene', 'ethylhexyl salicylate', 'butyl methoxydibenzoylmethane', 'ethylhexyl triazone', 'bis-ethylhexyloxyphenol methoxyphenyl triazine', 'drometrizole trisiloxane', 'terephthalylidene dicamphor sulfonic acid', 'titanium dioxide (nano] / titanium dioxide']"
https://incidecoder.com/products/the-chemistry-brand-retin-oil,The Chemistry Brand Retin-Oil,The,"C12-15 Alkyl Benzoate, Peg-20 Glyceryl Triisostearate, Hydroxypinacolone Retinoate, Ethyl Ascorbic Acid, Algae Extract, Oenocarpus Bataua Fruit Oil, Euterpe Oleracea Fruit Oil, Dimethyl Isosorbide, Caprylic/Capric Triglyceride, Ethyl Ascorbic Acid, Tocopherol, Tocopheryl Acetate, Hydroxypinacolone Retinoate, Ethyl Ascorbic Acid","['c12-15 alkyl benzoate', 'peg-20 glyceryl triisostearate', 'hydroxypinacolone retinoate', 'ethyl ascorbic acid', 'algae extract', 'oenocarpus bataua fruit oil', 'euterpe oleracea fruit oil', 'dimethyl isosorbide', 'caprylic/capric triglyceride', 'ethyl ascorbic acid', 'tocopherol', 'tocopheryl acetate', 'hydroxypinacolone retinoate', 'ethyl ascorbic acid']"
https://incidecoder.com/products/glossier-milky-oil,Glossier Milky Oil,Glossier,"Aqua/Water/Eau, Isohexadecane, PEG-40 Hydrogenated Castor Oil, Panthenol, Glycerin, PPG-26-Buteth-26, Symphytum Officinale Root Extract, Sodium Benzoate, Disodium EDTA, Glycerin, Panthenol, Symphytum Officinale Root Extract","['aqua/water/eau', 'isohexadecane', 'peg-40 hydrogenated castor oil', 'panthenol', 'glycerin', 'ppg-26-buteth-26', 'symphytum officinale root extract', 'sodium benzoate', 'disodium edta', 'glycerin', 'panthenol', 'symphytum officinale root extract']"
https://incidecoder.com/products/alpha-h-liquid-gold,Alpha-H Liquid Gold,Alpha-H,"Aqua, Alcohol Denat, Glycolic Acid (5%), Glycerin, Hydrolyzed Silk, Potassium Hydroxide, Phenoxyethanol, Caprylyl Glycol, Glycyrrhiza Glabra Extract, Glycolic Acid (5%), Glycyrrhiza Glabra Extract, Glycerin, Glycyrrhiza Glabra Extract","['aqua', 'alcohol denat', 'glycolic acid (5%)', 'glycerin', 'hydrolyzed silk', 'potassium hydroxide', 'phenoxyethanol', 'caprylyl glycol', 'glycyrrhiza glabra extract', 'glycolic acid (5%)', 'glycyrrhiza glabra extract', 'glycerin', 'glycyrrhiza glabra extract']"
https://incidecoder.com/products/ultrasun-anti-age-spf-50,Ultrasun Anti-Age Spf 50+,Ultrasun,"Aqua, Isostearyl Isostearate, Methylene Bis-Benzotriazolyl Tetramethylbutylphenol (Nano), Pentylene Glycol, Ethylhexyl Triazone, Titanium Dioxide (Nano), Bis-Ethylhexyloxyphenol Methoxyphenyl Triazine, Diethylamino Hydroxybenzoyl Hexyl Benzoate, Ethylhexyl Salicylate, Ectoin, Vitis Vinifera Seed Extract, Tocopheryl Acetate, Ascorbyl Tetraisopalmitate, Tocopherol, Ubiquinone, Ascorbyl Tetraisopalmitate, Glycerin, Squalane, Ectoin, Methylene Bis-Benzotriazolyl Tetramethylbutylphenol (Nano), Ethylhexyl Triazone, Titanium Dioxide (Nano), Bis-Ethylhexyloxyphenol Methoxyphenyl Triazine, Diethylamino Hydroxybenzoyl Hexyl Benzoate, Ethylhexyl Salicylate","['aqua', 'isostearyl isostearate', 'methylene bis-benzotriazolyl tetramethylbutylphenol (nano)', 'pentylene glycol', 'ethylhexyl triazone', 'titanium dioxide (nano)', 'bis-ethylhexyloxyphenol methoxyphenyl triazine', 'diethylamino hydroxybenzoyl hexyl benzoate', 'ethylhexyl salicylate', 'ectoin', 'vitis vinifera seed extract', 'tocopheryl acetate', 'ascorbyl tetraisopalmitate', 'tocopherol', 'ubiquinone', 'ascorbyl tetraisopalmitate', 'glycerin', 'squalane', 'ectoin', 'methylene bis-benzotriazolyl tetramethylbutylphenol (nano)', 'ethylhexyl triazone', 'titanium dioxide (nano)', 'bis-ethylhexyloxyphenol methoxyphenyl triazine', 'diethylamino hydroxybenzoyl hexyl benzoate', 'ethylhexyl salicylate']"
https://incidecoder.com/products/neogen-white-truffle-laycure-oil-stick,Neogen White Truffle Laycure Oil Stick,Neogen,"Olea Europaea (Olive) Fruit Oil, Octyldodecanol, Dibutyl Lauroyl Glutamide, Dibutyl Ethylhexanoyl Glutamide, Bisabolol, Hippophae Rhamnoides Oil, Pelargonium Graveolens Flower Oil, Mentha Piperita (Peppermint) Oil, Rose Flower Oil, Phytosphingosine, Olea Europaea (Olive) Fruit Oil, Hippophae Rhamnoides Oil, Persea Gratissima (Avocado) Oil, Phytosphingosine, Acetyl Hexapeptide-8, Dimethylmethoxy Chromanyl Palmitate, Glycerin, Ceramide 3, Cholesterol, Phytosphingosine, Hyaluronic Acid, Sodium Hyaluronate, Proline, Alanine, Serine, Bisabolol, Chamomilla Recutita (Matricaria) Flower Oil, Pseudoalteromonas Ferment Extract","['olea europaea (olive) fruit oil', 'octyldodecanol', 'dibutyl lauroyl glutamide', 'dibutyl ethylhexanoyl glutamide', 'bisabolol', 'hippophae rhamnoides oil', 'pelargonium graveolens flower oil', 'mentha piperita (peppermint) oil', 'rose flower oil', 'phytosphingosine', 'olea europaea (olive) fruit oil', 'hippophae rhamnoides oil', 'persea gratissima (avocado) oil', 'phytosphingosine', 'acetyl hexapeptide-8', 'dimethylmethoxy chromanyl palmitate', 'glycerin', 'ceramide 3', 'cholesterol', 'phytosphingosine', 'hyaluronic acid', 'sodium hyaluronate', 'proline', 'alanine', 'serine', 'bisabolol', 'chamomilla recutita (matricaria) flower oil', 'pseudoalteromonas ferment extract']"
https://incidecoder.com/products/charlotte-tilbury-charlottes-magic-cream-discontinued,Charlotte Tilbury Charlotte'S Magic Cream (Discontinued),Charlotte,"Water (Aqua), Homosalate, Glyceryl Stearate Se, Ethylhexyl Salicylate, Butylene Glycol, Glycerin, Butyl Methoxydibenzoylmethane, Octocrylene, Cetyl Alcohol, Avena Sativa (Oat) Kernel Extract, Tocopheryl Acetate, Tocopherol, Ascorbic Acid, Palmitoyl Oligopeptide, Palmitoyl Tetrapeptide-7, Ascorbic Acid, Glycerin, Sodium Hyaluronate, Avena Sativa (Oat) Kernel Extract, Allantoin, Aloe Barbadensis Leaf Juice, Homosalate, Ethylhexyl Salicylate, Butyl Methoxydibenzoylmethane, Octocrylene","['water (aqua)', 'homosalate', 'glyceryl stearate se', 'ethylhexyl salicylate', 'butylene glycol', 'glycerin', 'butyl methoxydibenzoylmethane', 'octocrylene', 'cetyl alcohol', 'avena sativa (oat) kernel extract', 'tocopheryl acetate', 'tocopherol', 'ascorbic acid', 'palmitoyl oligopeptide', 'palmitoyl tetrapeptide-7', 'ascorbic acid', 'glycerin', 'sodium hyaluronate', 'avena sativa (oat) kernel extract', 'allantoin', 'aloe barbadensis leaf juice', 'homosalate', 'ethylhexyl salicylate', 'butyl methoxydibenzoylmethane', 'octocrylene']"
https://incidecoder.com/products/medik8-r-retionate-youth-activating-cream,Medik8 R-Retionate Youth Activating Cream,Medik8,"Aqua (Water), Heptyl Undecylenate, Caprylic/Capric Triglyceride, Polylactic Acid, Methylpropanediol, Cetearyl Olivate, Sodium Polyacryloyldimethyl Taurate, Cetearyl Isononanoate, Distarch Phosphate, Tocopheryl Acetate, Tetrahexyldecyl Ascorbate, Ethyl Ascorbic Acid, Retinyl Retinoate, Tetrahexyldecyl Ascorbate, Ethyl Ascorbic Acid, Sodium Hyaluronate, Glycerin","['aqua (water)', 'heptyl undecylenate', 'caprylic/capric triglyceride', 'polylactic acid', 'methylpropanediol', 'cetearyl olivate', 'sodium polyacryloyldimethyl taurate', 'cetearyl isononanoate', 'distarch phosphate', 'tocopheryl acetate', 'tetrahexyldecyl ascorbate', 'ethyl ascorbic acid', 'retinyl retinoate', 'tetrahexyldecyl ascorbate', 'ethyl ascorbic acid', 'sodium hyaluronate', 'glycerin']"
https://incidecoder.com/products/lixir-good-skin-day-shaker,Lixir Good Skin Day Shaker,Lixir,"Aqua (Water), Perfluorohexane, Glycerin, Perfluorodecalin, Perfluoroperhydrophenanthrene, Oxygen, Phenoxyethanol, Pullulan, Sodium Hyaluronate, Glycerin, Sodium Hyaluronate","['aqua (water)', 'perfluorohexane', 'glycerin', 'perfluorodecalin', 'perfluoroperhydrophenanthrene', 'oxygen', 'phenoxyethanol', 'pullulan', 'sodium hyaluronate', 'glycerin', 'sodium hyaluronate']"
https://incidecoder.com/products/clinique-even-better-essence-lotion-combo-oily-skin,Clinique Even Better Essence Lotion Combo-Oily Skin,Clinique,"Water\Aqua\Eau, Butylene Glycol, Glycerin, Citrullus Vulgaris (Watermelon) Fruit Extract, Pyrus Malus (Apple) Fruit Extract, Lens Esculenta (Lentil) Fruit Extract, Tamarindus Indica Seed Extract, Cucumis Sativus (Cucumber) Fruit Extract, Laminaria Saccharina Extract, Citrullus Vulgaris (Watermelon) Fruit Extract, Scutellaria Baicalensis Root Extract, Camellia Sinensis Leaf Extract, Ergothioneine, Caffeine, Acetyl Glucosamine, Glycerin, Sodium Hyaluronate, Sodium Pca, Acetyl Glucosamine, Cucumis Sativus (Cucumber) Fruit Extract, Laminaria Saccharina Extract, Scutellaria Baicalensis Root Extract, Camellia Sinensis Leaf Extract, Sucrose, Saccharomyces Ferment Filtrate","['water\\aqua\\eau', 'butylene glycol', 'glycerin', 'citrullus vulgaris (watermelon) fruit extract', 'pyrus malus (apple) fruit extract', 'lens esculenta (lentil) fruit extract', 'tamarindus indica seed extract', 'cucumis sativus (cucumber) fruit extract', 'laminaria saccharina extract', 'citrullus vulgaris (watermelon) fruit extract', 'scutellaria baicalensis root extract', 'camellia sinensis leaf extract', 'ergothioneine', 'caffeine', 'acetyl glucosamine', 'glycerin', 'sodium hyaluronate', 'sodium pca', 'acetyl glucosamine', 'cucumis sativus (cucumber) fruit extract', 'laminaria saccharina extract', 'scutellaria baicalensis root extract', 'camellia sinensis leaf extract', 'sucrose', 'saccharomyces ferment filtrate']"
https://incidecoder.com/products/indie-lee-swiss-apple-facial-serum,Indie Lee Swiss Apple Facial Serum,Indie,"Seaweed Extract, Purified Water, Hyaluronic Acid, Malus Domestica Fruit Cell Culture, Xanthan Gum, Lecithin, Phenoxyethanol, Ethylhexylglycerin, Hyaluronic Acid","['seaweed extract', 'purified water', 'hyaluronic acid', 'malus domestica fruit cell culture', 'xanthan gum', 'lecithin', 'phenoxyethanol', 'ethylhexylglycerin', 'hyaluronic acid']"
https://incidecoder.com/products/the-inkey-list-retinol-serum,The Inkey List Retinol Serum,The,"Water (Aqua/Eau), Glycerin, Butylene Glycol, Propanediol, Dicaprylyl Carbonate, Dimethicone, Hydroxyethyl Acrylate/Sodium Acryloyldimethyl Taurate Copolymer, Caprylyl Glycol, Phospholipids, Sodium Ascorbate, Tocopherol, Tocopheryl Acetate, Hydroxypinacolone Retinoate 0.05%, Retinol 0.05%, Palmitoyl Tetrapeptide-7, Palmitoyl Tripeptide-1, Glycerin, Phospholipids, Squalane, Hyaluronic Acid","['water (aqua/eau)', 'glycerin', 'butylene glycol', 'propanediol', 'dicaprylyl carbonate', 'dimethicone', 'hydroxyethyl acrylate/sodium acryloyldimethyl taurate copolymer', 'caprylyl glycol', 'phospholipids', 'sodium ascorbate', 'tocopherol', 'tocopheryl acetate', 'hydroxypinacolone retinoate 0.05%', 'retinol 0.05%', 'palmitoyl tetrapeptide-7', 'palmitoyl tripeptide-1', 'glycerin', 'phospholipids', 'squalane', 'hyaluronic acid']"
https://incidecoder.com/products/bioderma-photoderm-leb-spf-30,Bioderma Photoderm LEB Spf 30,Bioderma,"Aqua/Water/Eau, Dicaprylyl Carbonate, Diisopropyl Sebacate, Methylene Bis-Benzotriazolyl Tetramethylbutylphenol, Butyl Methoxydibenzoylmethane, Bis-Ethylhexyloxyphenol Methoxyphenyl Triazine, Cyclopentasiloxane, Methylpropanediol, Decyl Glucoside, Ectoin, Ectoin, Methylene Bis-Benzotriazolyl Tetramethylbutylphenol, Butyl Methoxydibenzoylmethane, Bis-Ethylhexyloxyphenol Methoxyphenyl Triazine","['aqua/water/eau', 'dicaprylyl carbonate', 'diisopropyl sebacate', 'methylene bis-benzotriazolyl tetramethylbutylphenol', 'butyl methoxydibenzoylmethane', 'bis-ethylhexyloxyphenol methoxyphenyl triazine', 'cyclopentasiloxane', 'methylpropanediol', 'decyl glucoside', 'ectoin', 'ectoin', 'methylene bis-benzotriazolyl tetramethylbutylphenol', 'butyl methoxydibenzoylmethane', 'bis-ethylhexyloxyphenol methoxyphenyl triazine']"
https://incidecoder.com/products/drunk-elephant-lala-retro-whipped-cream,Drunk Elephant Lala Retro Whipped Cream,Drunk,"Water/Aqua/Eau, Glycerin, Caprylic/Capric Triglyceride, Isopropyl Isostearate, Pseudozyma Epicola/Camellia Sinensis Seed Oil/Glucose/Glycine Soja (Soybean) Meal/Malt Extract/Yeast Extract Ferment Filtrate, Glyceryl Stearate SE, Cetearyl Alcohol, Palmitic Acid, Stearic Acid, Phytosphingosine, Plantago Lanceolata Leaf Extract, Sodium Hyaluronate Crosspolymer, Tocopherol, Phytosphingosine, Glycerin, Cholesterol, Ceramide AP, Ceramide EOP, Sodium Hyaluronate Crosspolymer, Ceramide NP, Phytosphingosine, Plantago Lanceolata Leaf Extract","['water/aqua/eau', 'glycerin', 'caprylic/capric triglyceride', 'isopropyl isostearate', 'pseudozyma epicola/camellia sinensis seed oil/glucose/glycine soja (soybean) meal/malt extract/yeast extract ferment filtrate', 'glyceryl stearate se', 'cetearyl alcohol', 'palmitic acid', 'stearic acid', 'phytosphingosine', 'plantago lanceolata leaf extract', 'sodium hyaluronate crosspolymer', 'tocopherol', 'phytosphingosine', 'glycerin', 'cholesterol', 'ceramide ap', 'ceramide eop', 'sodium hyaluronate crosspolymer', 'ceramide np', 'phytosphingosine', 'plantago lanceolata leaf extract']"
https://incidecoder.com/products/acne-org-moisturizer-with-licochalcone-discontinued,Acne.org Moisturizer With Licochalcone (Discontinued),Acne.org,"Water, Simmondsia Chinensis (Jojoba) Seed Oil, Methyl Gluceth-20, Squalane, Saccharide Isomerate, Butylene Glycol, Sodium Hyaluronate, Glycyrrhiza Glabra (Licorice) Root Extract, Panthenol, Tocopheryl Acetate, Glycyrrhiza Glabra (Licorice) Root Extract, Squalane, Sodium Hyaluronate, Glycyrrhiza Glabra (Licorice) Root Extract, Panthenol","['water', 'simmondsia chinensis (jojoba) seed oil', 'methyl gluceth-20', 'squalane', 'saccharide isomerate', 'butylene glycol', 'sodium hyaluronate', 'glycyrrhiza glabra (licorice) root extract', 'panthenol', 'tocopheryl acetate', 'glycyrrhiza glabra (licorice) root extract', 'squalane', 'sodium hyaluronate', 'glycyrrhiza glabra (licorice) root extract', 'panthenol']"
https://incidecoder.com/products/clinique-moisture-surge-hydrating-supercharged-concentrate,Clinique Moisture Surge Hydrating Supercharged Concentrate,Clinique,"Water\Aqua\Eau, Glycerin, Butylene Glycol, Phenyl Trimethicone, Propanediol, Sucrose, Hydroxyethyl Urea, Alteromonas Ferment Extract, Hydrolyzed Rice Extract, Caffeine, Tocopheryl Acetate, Tetrahexyldecyl Ascorbate, Acetyl Glucosamine, Tetrahexyldecyl Ascorbate, Glycerin, Acetyl Glucosamine, Cholesterol, Sodium Hyaluronate, Sucrose, Alteromonas Ferment Extract, Benzophenone-4","['water\\aqua\\eau', 'glycerin', 'butylene glycol', 'phenyl trimethicone', 'propanediol', 'sucrose', 'hydroxyethyl urea', 'alteromonas ferment extract', 'hydrolyzed rice extract', 'caffeine', 'tocopheryl acetate', 'tetrahexyldecyl ascorbate', 'acetyl glucosamine', 'tetrahexyldecyl ascorbate', 'glycerin', 'acetyl glucosamine', 'cholesterol', 'sodium hyaluronate', 'sucrose', 'alteromonas ferment extract', 'benzophenone-4']"
https://incidecoder.com/products/the-ordinary-ascorbyl-tetraisopalmitate-solution-20-in-vitamin-f,The Ordinary Ascorbyl Tetraisopalmitate Solution 20% In Vitamin F,The,"Coconut Alkanes, Tetrahexyldecyl Ascorbate 20.0%, Ethyl Linoleate, Coco-Caprylate/Caprate, Simmondsia Chinensis (Jojoba) Seed Oil, Solanum Lycopersicum (Tomato) Fruit Extract, Squalane, Tetrahexyldecyl Ascorbate 20.0%, Solanum Lycopersicum (Tomato) Fruit Extract, Tetrahexyldecyl Ascorbate 20.0%, Squalane","['coconut alkanes', 'tetrahexyldecyl ascorbate 20.0%', 'ethyl linoleate', 'coco-caprylate/caprate', 'simmondsia chinensis (jojoba) seed oil', 'solanum lycopersicum (tomato) fruit extract', 'squalane', 'tetrahexyldecyl ascorbate 20.0%', 'solanum lycopersicum (tomato) fruit extract', 'tetrahexyldecyl ascorbate 20.0%', 'squalane']"
https://incidecoder.com/products/paulas-choice-resist-advanced-pore-refining-treatment-4-bha,Paula's Choice Resist Advanced Pore-Refining Treatment 4% Bha,Paula's,"Water (Aqua), Butylene Glycol, Dimethicone, Salicylic Acid, Hydroxyethyl Acrylate/Sodium Acryloyldimethyl Taurate Copolymer, Glycerin, Aminomethyl Propanol, Adenosine, Allantoin, Salicylic Acid, Vitis Vinifera (Grape) Seed Extract, Camellia Oleifera (Green Tea) Leaf Extract, Camellia Sinensis (Green Tea) Leaf Extract, Chamomilla Recutita (Matricaria) Flower Extract, Adenosine, Salicylic Acid, Glycerin, Salicylic Acid, Allantoin, Dipotassium Glycyrrhizate, Avena Sativa (Oat) Bran Extract, Camellia Oleifera (Green Tea) Leaf Extract, Camellia Sinensis (Green Tea) Leaf Extract, Chamomilla Recutita (Matricaria) Flower Extract","['water (aqua)', 'butylene glycol', 'dimethicone', 'salicylic acid', 'hydroxyethyl acrylate/sodium acryloyldimethyl taurate copolymer', 'glycerin', 'aminomethyl propanol', 'adenosine', 'allantoin', 'salicylic acid', 'vitis vinifera (grape) seed extract', 'camellia oleifera (green tea) leaf extract', 'camellia sinensis (green tea) leaf extract', 'chamomilla recutita (matricaria) flower extract', 'adenosine', 'salicylic acid', 'glycerin', 'salicylic acid', 'allantoin', 'dipotassium glycyrrhizate', 'avena sativa (oat) bran extract', 'camellia oleifera (green tea) leaf extract', 'camellia sinensis (green tea) leaf extract', 'chamomilla recutita (matricaria) flower extract']"
https://incidecoder.com/products/vintners-daughter-active-botanical-serum,Vintner's Daughter Active Botanical Serum,Vintner's,"Vitis Vinifera (Grape) Seed Oil, Corylus Avellana (Hazelnut) Seed Oil, Citrus Limon (Lemon) Peel Oil, Persea Gratissima (Avocado) Oil, Lavandula Hybrida (Lavender) Oil, Rosa Damascena (Rose) Flower Oil, Daucus Carota Sativa (Carrot) Seed Oil, Oenothera Biennis (Evening Primrose) Seed Extract, Rosa Canina (Rosehip) Seed Extract, Vitis Vinifera (Grape) Seed Oil, Persea Gratissima (Avocado) Oil, Rosa Damascena (Rose) Flower Oil, Calendula Officinalis (Marigold) Extract, Calophyllum Inophyllum (Tamanu) Seed Oil, Curcuma Longa (Turmeric) Root Extract, Rosmarinus Officinalis (Rosemary) Leaf Extract, Curcuma Longa (Turmeric) Root Extract, Calendula Officinalis (Marigold) Extract, Urtica Dioica (Nettle) Leaf Extract, Curcuma Longa (Turmeric) Root Extract, Rosmarinus Officinalis (Rosemary) Leaf Extract","['vitis vinifera (grape) seed oil', 'corylus avellana (hazelnut) seed oil', 'citrus limon (lemon) peel oil', 'persea gratissima (avocado) oil', 'lavandula hybrida (lavender) oil', 'rosa damascena (rose) flower oil', 'daucus carota sativa (carrot) seed oil', 'oenothera biennis (evening primrose) seed extract', 'rosa canina (rosehip) seed extract', 'vitis vinifera (grape) seed oil', 'persea gratissima (avocado) oil', 'rosa damascena (rose) flower oil', 'calendula officinalis (marigold) extract', 'calophyllum inophyllum (tamanu) seed oil', 'curcuma longa (turmeric) root extract', 'rosmarinus officinalis (rosemary) leaf extract', 'curcuma longa (turmeric) root extract', 'calendula officinalis (marigold) extract', 'urtica dioica (nettle) leaf extract', 'curcuma longa (turmeric) root extract', 'rosmarinus officinalis (rosemary) leaf extract']"
