product_url,name,brand,ingredients_raw,ingredients_list
https://incidecoder.com/products/avene-tolerance-extreme-creme-discontinued,Avene Tolerance Extreme Creme (Discontinued),Avene,"Avene Thermal Spring Water (Avene Aqua), Caprylic/Capric Triglyceride, Glycerin, Butyrospermum Parkii (Shea) Butter (Butyrospermum Parkii Butter), Carthamus Tinctorius (Safflower) Seed Oil (Carthamus Tinctorius Seed Oil), Behenyl Alcohol, Sodium Acrylates/C10-30 Alkyl Acrylate Crosspolymer, Water (Aqua), Carthamus Tinctorius (Safflower) Seed Oil (Carthamus Tinctorius Seed Oil), Glycerin","['avene thermal spring water (avene aqua)', 'caprylic/capric triglyceride', 'glycerin', 'butyrospermum parkii (shea) butter (butyrospermum parkii butter)', 'carthamus tinctorius (safflower) seed oil (carthamus tinctorius seed oil)', 'behenyl alcohol', 'sodium acrylates/c10-30 alkyl acrylate crosspolymer', 'water (aqua)', 'carthamus tinctorius (safflower) seed oil (carthamus tinctorius seed oil)', 'glycerin']"
https://incidecoder.com/products/beauty-pie-triple-hyaluronic-ha-peptide-serum,Beauty Pie Triple Hyaluronic Ha + Peptide Serum,Beauty,"Aqua (Water), Methylpropanediol, Dimethylsilanol Hyaluronate, Glycerin, Butylene Glycol, Xylitylglucoside, Anhydroxylitol, 1,2 Hexanediol, Phenoxyethanol, Acetyl Dipeptide-1 Cetyl Ester, Glycerin, Sodium Hyaluronate, Hyaluronic Acid, Acetyl Dipeptide-1 Cetyl Ester, Alteromonas Ferment Extract","['aqua (water)', 'methylpropanediol', 'dimethylsilanol hyaluronate', 'glycerin', 'butylene glycol', 'xylitylglucoside', 'anhydroxylitol', '1', '2 hexanediol', 'phenoxyethanol', 'acetyl dipeptide-1 cetyl ester', 'glycerin', 'sodium hyaluronate', 'hyaluronic acid', 'acetyl dipeptide-1 cetyl ester', 'alteromonas ferment extract']"
https://incidecoder.com/products/some-by-mi-aha-bha-pha-tea-tree-30-days-miracle-cream-discontinued,"Some By Mi Aha, Bha, Pha Tea Tree 30 Days Miracle Cream (Discontinued)",Some,"Centella Asiatica Extract (70.78%), Dipropylene Glycol, Glycerin, Water, Niacinamide, Caprylic/Capric Triglyceride, Cetyl Ethylhexanoate, Melaleuca Alternifolia (Tea Tree) Leaf Extract(10,000Ppm), Cholesteryl/Behenyl/Octyldodecyl Lauroyl Glutamate, Niacinamide, Centella Asiatica Extract (70.78%), Curcuma Longa (Turmeric) Root Extract, Calendula Officinalis Flower Extract, Camellia Sinensis Leaf Extract, Hamamelis Virginiana (Witch Hazel) Extract, Houttuynia Cordata Extract, Madecassoside, Asiaticoside, Niacinamide, Adenosine, Capryloyl Salicylic Acid(100Ppm), Lactobionic Acid(100Ppm), Niacinamide, Curcuma Longa (Turmeric) Root Extract, Glycerin, Sodium Hyaluronate, Ceramide NP, Centella Asiatica Extract (70.78%), Curcuma Longa (Turmeric) Root Extract, Calendula Officinalis Flower Extract, Camellia Sinensis Leaf Extract, Salix Alba (Willow) Bark Extract, Hamamelis Virginiana (Witch Hazel) Extract, Houttuynia Cordata Extract, Allantoin, Madecassoside","['centella asiatica extract (70.78%)', 'dipropylene glycol', 'glycerin', 'water', 'niacinamide', 'caprylic/capric triglyceride', 'cetyl ethylhexanoate', 'melaleuca alternifolia (tea tree) leaf extract(10', '000ppm)', 'cholesteryl/behenyl/octyldodecyl lauroyl glutamate', 'niacinamide', 'centella asiatica extract (70.78%)', 'curcuma longa (turmeric) root extract', 'calendula officinalis flower extract', 'camellia sinensis leaf extract', 'hamamelis virginiana (witch hazel) extract', 'houttuynia cordata extract', 'madecassoside', 'asiaticoside', 'niacinamide', 'adenosine', 'capryloyl salicylic acid(100ppm)', 'lactobionic acid(100ppm)', 'niacinamide', 'curcuma longa (turmeric) root extract', 'glycerin', 'sodium hyaluronate', 'ceramide np', 'centella asiatica extract (70.78%)', 'curcuma longa (turmeric) root extract', 'calendula officinalis flower extract', 'camellia sinensis leaf extract', 'salix alba (willow) bark extract', 'hamamelis virginiana (witch hazel) extract', 'houttuynia cordata extract', 'allantoin', 'madecassoside']"
https://incidecoder.com/products/paulas-choice-resist-10-niacinamide-booster-discontinued,Paula's Choice 10% Niacinamide Booster (Discontinued),Paula's,"Water (Aqua), Niacinamide 10.0%, Acetyl Glucosamine, Ascorbyl Glucoside, Butylene Glycol, Phospholipids, Sodium Hyaluronate, Allantoin, Boerhavia Diffusa Root Extract, Niacinamide 10.0%, Ascorbyl Glucoside, Ubiquinone, Epigallocatechin Gallate, Carnosine, Genistein, Niacinamide 10.0%, Carnosine, Niacinamide 10.0%, Acetyl Glucosamine, Ascorbyl Glucoside, Glycyrrhiza Glabra (Licorice) Root Extract, Acetyl Glucosamine, Phospholipids, Sodium Hyaluronate, Glycerin, Allantoin, Dipotassium Glycyrrhizate, Glycyrrhiza Glabra (Licorice) Root Extract, Epigallocatechin Gallate, Beta-Glucan, Panthenol","['water (aqua)', 'niacinamide 10.0%', 'acetyl glucosamine', 'ascorbyl glucoside', 'butylene glycol', 'phospholipids', 'sodium hyaluronate', 'allantoin', 'boerhavia diffusa root extract', 'niacinamide 10.0%', 'ascorbyl glucoside', 'ubiquinone', 'epigallocatechin gallate', 'carnosine', 'genistein', 'niacinamide 10.0%', 'carnosine', 'niacinamide 10.0%', 'acetyl glucosamine', 'ascorbyl glucoside', 'glycyrrhiza glabra (licorice) root extract', 'acetyl glucosamine', 'phospholipids', 'sodium hyaluronate', 'glycerin', 'allantoin', 'dipotassium glycyrrhizate', 'glycyrrhiza glabra (licorice) root extract', 'epigallocatechin gallate', 'beta-glucan', 'panthenol']"
https://incidecoder.com/products/paulas-choice-defense-antioxidant-pore-purifier,Paula's Choice Defense Antioxidant Pore Purifier,Paula's,"Water, Propanediol, Butylene Glycol, Ethoxydiglycol, Glycerin, Ascorbyl Glucoside, Panthenol, Salicylic Acid, Camellia Sinensis (White Tea) Leaf Extract, Salicylic Acid, Potassium Azeloyl Diglycinate, Niacinamide, Ascorbyl Glucoside, Camellia Sinensis (White Tea) Leaf Extract, Coffea Arabica (Coffee) Fruit Extract, Vitis Vinifera (Grape) Seed Extract, Panax Ginseng Root Extract, Epigallocatechin Gallate, Ubiquinone, Calendula Officinalis (English Marigold) Extract, Centella Asiatica Extract, Glycine Soja (Soybean) Seed Extract, Niacinamide, Adenosine, Salicylic Acid, Ascorbyl Glucoside, Glycyrrhiza Glabra (Licorice) Root Extract, Potassium Azeloyl Diglycinate, Niacinamide, Glycine Soja (Soybean) Seed Extract, Glycerin, Ceramide Np, Sodium Hyaluronate, Panthenol, Salicylic Acid, Camellia Sinensis (White Tea) Leaf Extract, Glycyrrhiza Glabra (Licorice) Root Extract, Potassium Azeloyl Diglycinate, Epigallocatechin Gallate, Calendula Officinalis (English Marigold) Extract, Centella Asiatica Extract, Glycine Soja (Soybean) Seed Extract","['water', 'propanediol', 'butylene glycol', 'ethoxydiglycol', 'glycerin', 'ascorbyl glucoside', 'panthenol', 'salicylic acid', 'camellia sinensis (white tea) leaf extract', 'salicylic acid', 'potassium azeloyl diglycinate', 'niacinamide', 'ascorbyl glucoside', 'camellia sinensis (white tea) leaf extract', 'coffea arabica (coffee) fruit extract', 'vitis vinifera (grape) seed extract', 'panax ginseng root extract', 'epigallocatechin gallate', 'ubiquinone', 'calendula officinalis (english marigold) extract', 'centella asiatica extract', 'glycine soja (soybean) seed extract', 'niacinamide', 'adenosine', 'salicylic acid', 'ascorbyl glucoside', 'glycyrrhiza glabra (licorice) root extract', 'potassium azeloyl diglycinate', 'niacinamide', 'glycine soja (soybean) seed extract', 'glycerin', 'ceramide np', 'sodium hyaluronate', 'panthenol', 'salicylic acid', 'camellia sinensis (white tea) leaf extract', 'glycyrrhiza glabra (licorice) root extract', 'potassium azeloyl diglycinate', 'epigallocatechin gallate', 'calendula officinalis (english marigold) extract', 'centella asiatica extract', 'glycine soja (soybean) seed extract']"
https://incidecoder.com/products/the-ordinary-high-adherence-silicone-primer,The Ordinary High-Adherence Silicone Primer,The,"Aqua (Water), Isodecyl Neopentanoate, Dimethicone, Dimethicone/Bis-Isobutyl PPG-20 Crosspolymer, Hydroxyethyl Acrylate/Sodium Acryloyldimethyl Taurate Copolymer, Isohexadecane, Hexamethyldisiloxane, Isoceteth-20, Polysilicone-11, Tocopherol","['aqua (water)', 'isodecyl neopentanoate', 'dimethicone', 'dimethicone/bis-isobutyl ppg-20 crosspolymer', 'hydroxyethyl acrylate/sodium acryloyldimethyl taurate copolymer', 'isohexadecane', 'hexamethyldisiloxane', 'isoceteth-20', 'polysilicone-11', 'tocopherol']"
https://incidecoder.com/products/hada-labo-skin-plumping-gel-cream,Hada Labo Skin Plumping Gel Cream,Hada,"Water, Hydroxyethyl Urea, Butylene Glycol, Glycerin, Pentylene Glycol, Peg/Ppg/Polybutylene Glycol-8/5/3 Glycerin, Squalane, Triethylhexanoin, Ammonium Acryloyldimethyltaurate/Vp Copolymer, Glycerin, Squalane, Arginine, Sodium Hyaluronate","['water', 'hydroxyethyl urea', 'butylene glycol', 'glycerin', 'pentylene glycol', 'peg/ppg/polybutylene glycol-8/5/3 glycerin', 'squalane', 'triethylhexanoin', 'ammonium acryloyldimethyltaurate/vp copolymer', 'glycerin', 'squalane', 'arginine', 'sodium hyaluronate']"
https://incidecoder.com/products/caudalie-vinoperfect-radiance-serum-discontinued,Caudalie Vinoperfect Radiance Serum (Discontinued),Caudalie,"Water, Butylene Glycol, Glycerin*, Squalane*, Tocopheryl Acetate*, Ceteareth-20*, Palmitoyl Grapevine Shoot Extract*, Glyceryl Stearate Se*, Parfum (Fragrance), Tocopheryl Acetate*, Palmitoyl Grapevine Shoot Extract*, Palmitoyl Grapevine Shoot Extract*, Glycerin*, Squalane*","['water', 'butylene glycol', 'glycerin*', 'squalane*', 'tocopheryl acetate*', 'ceteareth-20*', 'palmitoyl grapevine shoot extract*', 'glyceryl stearate se*', 'parfum (fragrance)', 'tocopheryl acetate*', 'palmitoyl grapevine shoot extract*', 'palmitoyl grapevine shoot extract*', 'glycerin*', 'squalane*']"
https://incidecoder.com/products/the-ordinary-mineral-uv-filters-spf-30-with-antioxidants,The Ordinary Mineral Uv Filters Spf 30 With Antioxidants,The,"Aqua (Water), Cyclopentasiloxane, Zinc Oxide, Titanium Dioxide, Peg-10 Dimethicone, Glycerin, Helianthus Annuus Seed Oil, Peg-9 Polydimethylsiloxyethyl Dimethicone, Hexyl Laurate, Astaxanthin, Ethyl Ferulate, Rosmarinus Officinalis Leaf Extract, Tasmannia Lanceolata Fruit/Leaf Extract, Haematococcus Pluvialis Extract, Picea Mariana Bark Extract, Tocopherol, Glycerin, Arginine, Aspartic Acid, Glycine, Alanine, Serine, Valine, Isoleucine, Proline, Threonine, Histidine, Phenylalanine, Sodium Pca, Pca, Urea, Sodium Hyaluronate, Linoleic Acid, Rosmarinus Officinalis Leaf Extract, Tasmannia Lanceolata Fruit/Leaf Extract, Allantoin, Zinc Oxide, Titanium Dioxide","['aqua (water)', 'cyclopentasiloxane', 'zinc oxide', 'titanium dioxide', 'peg-10 dimethicone', 'glycerin', 'helianthus annuus seed oil', 'peg-9 polydimethylsiloxyethyl dimethicone', 'hexyl laurate', 'astaxanthin', 'ethyl ferulate', 'rosmarinus officinalis leaf extract', 'tasmannia lanceolata fruit/leaf extract', 'haematococcus pluvialis extract', 'picea mariana bark extract', 'tocopherol', 'glycerin', 'arginine', 'aspartic acid', 'glycine', 'alanine', 'serine', 'valine', 'isoleucine', 'proline', 'threonine', 'histidine', 'phenylalanine', 'sodium pca', 'pca', 'urea', 'sodium hyaluronate', 'linoleic acid', 'rosmarinus officinalis leaf extract', 'tasmannia lanceolata fruit/leaf extract', 'allantoin', 'zinc oxide', 'titanium dioxide']"
https://incidecoder.com/products/resurface-by-shani-darden-retinol-reform,Resurface by Shani Darden Retinol Reform,Resurface,"Deionized Water, Retinyl Propionate 5.0%, Aloe Vera, Glycereth-26, Octyldimethyl, Polysorbate-80, Propylene Glycol, Sodium Lactate, Sodium PCA, Niacinamide, Retinyl Propionate 5.0%, Niacinamide, Lactic Acid, Niacinamide, Sodium PCA, Aloe Vera","['deionized water', 'retinyl propionate 5.0%', 'aloe vera', 'glycereth-26', 'octyldimethyl', 'polysorbate-80', 'propylene glycol', 'sodium lactate', 'sodium pca', 'niacinamide', 'retinyl propionate 5.0%', 'niacinamide', 'lactic acid', 'niacinamide', 'sodium pca', 'aloe vera']"
https://incidecoder.com/products/the-ordinary-matrixyl-10-ha,The Ordinary Matrixyl 10% + Ha,The,"Aqua (Water), Glycerin, Butylene Glycol, Palmitoyl Tripeptide-1, Palmitoyl Tetrapeptide-7, Palmitoyl Tripeptide-38, Sodium Hyaluronate, Hydroxypropyl Cyclodextrin, PPG-26-Buteth-26, Palmitoyl Tripeptide-1, Palmitoyl Tetrapeptide-7, Palmitoyl Tripeptide-38, Glycerin, Sodium Hyaluronate","['aqua (water)', 'glycerin', 'butylene glycol', 'palmitoyl tripeptide-1', 'palmitoyl tetrapeptide-7', 'palmitoyl tripeptide-38', 'sodium hyaluronate', 'hydroxypropyl cyclodextrin', 'ppg-26-buteth-26', 'palmitoyl tripeptide-1', 'palmitoyl tetrapeptide-7', 'palmitoyl tripeptide-38', 'glycerin', 'sodium hyaluronate']"
https://incidecoder.com/products/drunk-elephant-b-hydra-intensive-hydration-serum,Drunk Elephant B-Hydra Intensive Hydration Serum,Drunk,"Water/Aqua/Eau, Coconut Alkanes, Ammonium Acryloyldimethyltaurate/Vp Copolymer, Glycerin, Pentylene Glycol, Sclerocarya Birrea Seed Oil, Wheat Amino Acids, Ananas Sativus (Pineapple) Fruit Extract, Berberis Vulgaris Root Extract, Berberis Vulgaris Root Extract, Niacinamide, Citrullus Lanatus (Watermelon) Fruit Extract, Sodium Hyaluronate Crosspolymer, Niacinamide, Niacinamide, Glycerin, Sodium Pca, Sodium Hyaluronate Crosspolymer, Sodium Hyaluronate, Wheat Amino Acids, Ananas Sativus (Pineapple) Fruit Extract, Berberis Vulgaris Root Extract, Panthenol, Dipotassium Glycyrrhizate","['water/aqua/eau', 'coconut alkanes', 'ammonium acryloyldimethyltaurate/vp copolymer', 'glycerin', 'pentylene glycol', 'sclerocarya birrea seed oil', 'wheat amino acids', 'ananas sativus (pineapple) fruit extract', 'berberis vulgaris root extract', 'berberis vulgaris root extract', 'niacinamide', 'citrullus lanatus (watermelon) fruit extract', 'sodium hyaluronate crosspolymer', 'niacinamide', 'niacinamide', 'glycerin', 'sodium pca', 'sodium hyaluronate crosspolymer', 'sodium hyaluronate', 'wheat amino acids', 'ananas sativus (pineapple) fruit extract', 'berberis vulgaris root extract', 'panthenol', 'dipotassium glycyrrhizate']"
https://incidecoder.com/products/bioeffect-egf-serum,Bioeffect EGF Serum,Bioeffect,"Glycerine, Water, Sodium Hyaluronate, Tromethamine, Sodium Chloride, Hordeum Vulgare Seed Extract, Egf (Barley Sh-Oligopeptide-1), Egf (Barley Sh-Oligopeptide-1), Glycerine, Sodium Hyaluronate","['glycerine', 'water', 'sodium hyaluronate', 'tromethamine', 'sodium chloride', 'hordeum vulgare seed extract', 'egf (barley sh-oligopeptide-1)', 'egf (barley sh-oligopeptide-1)', 'glycerine', 'sodium hyaluronate']"
https://incidecoder.com/products/tatcha-silken-pore-perfecting-sunscreen-broad-spectrum-spf-35-pa,Tatcha Silken Pore Perfecting Sunscreen Broad Spectrum Spf 35 Pa+++,Tatcha,"Zinc Oxide (15%), Octisalate (5%), Water, Isododecane, Cyclopentasiloxane, Propanediol, Hdi/Trimethylol Hexyllactone Crosspolymer, Glycerin, Dimethicone, Camellia Sinensis Leaf Extract, Glycerin, Stearyl Glycyrrhetinate, Camellia Sinensis Leaf Extract, Zinc Oxide (15%), Octisalate (5%), Titanium Dioxide (Ci 77891)","['zinc oxide (15%)', 'octisalate (5%)', 'water', 'isododecane', 'cyclopentasiloxane', 'propanediol', 'hdi/trimethylol hexyllactone crosspolymer', 'glycerin', 'dimethicone', 'camellia sinensis leaf extract', 'glycerin', 'stearyl glycyrrhetinate', 'camellia sinensis leaf extract', 'zinc oxide (15%)', 'octisalate (5%)', 'titanium dioxide (ci 77891)']"
https://incidecoder.com/products/pixi-pixi-caroline-hirons-double-cleanse-cream,Pixi Pixi + Caroline Hirons Double Cleanse (Cream),Pixi,"Water/Aqua/Eau, Caprylic/Capric Triglyceride, Cetyl Ethylhexanoate, Glycerin, Hydrogenated Polydecene, Dipropylene Glycol, Sorbitan Stearate, Cetearyl Alcohol, Polysorbate 80, Tocopheryl Acetate, Ascorbic Acid, Camellia Sinensis Leaf Extract, Sh-Decapeptide-7, Sh-Octapeptide-4, Acetyl Hexapeptide-8, Sh-Decapeptide-7, Sh-Octapeptide-4, Ascorbic Acid, Glycerin, Arginine, Sodium Hyaluronate, Allantoin, Camellia Sinensis Leaf Extract, Aloe Barbadensis Leaf Juice Powder","['water/aqua/eau', 'caprylic/capric triglyceride', 'cetyl ethylhexanoate', 'glycerin', 'hydrogenated polydecene', 'dipropylene glycol', 'sorbitan stearate', 'cetearyl alcohol', 'polysorbate 80', 'tocopheryl acetate', 'ascorbic acid', 'camellia sinensis leaf extract', 'sh-decapeptide-7', 'sh-octapeptide-4', 'acetyl hexapeptide-8', 'sh-decapeptide-7', 'sh-octapeptide-4', 'ascorbic acid', 'glycerin', 'arginine', 'sodium hyaluronate', 'allantoin', 'camellia sinensis leaf extract', 'aloe barbadensis leaf juice powder']"
https://incidecoder.com/products/skinceuticals-serum-20-aox,SkinCeuticals Serum 20 AOX+,SkinCeuticals,"Aqua / Water / Eau, Ascorbic Acid 20.0%, Ethoxydiglycol, Propylene Glycol, Glycerin, Zinc Sulfate, Phenoxyethanol, Sodium Hydroxide, Panthenol, Ascorbic Acid 20.0%, Ferulic Acid 0.2%, Ascorbic Acid 20.0%, Glycerin, Sodium Hyaluronate, Panthenol","['aqua / water / eau', 'ascorbic acid 20.0%', 'ethoxydiglycol', 'propylene glycol', 'glycerin', 'zinc sulfate', 'phenoxyethanol', 'sodium hydroxide', 'panthenol', 'ascorbic acid 20.0%', 'ferulic acid 0.2%', 'ascorbic acid 20.0%', 'glycerin', 'sodium hyaluronate', 'panthenol']"
https://incidecoder.com/products/omorovicza-balancing-moisturiser,Omorovicza Balancing Moisturiser,Omorovicza,"Aqua (Hungarian Thermal Water), Glycerin, Cetearyl Ethylhexanoate, Squalane, Corundum, Stearyl Heptanoate, Cetearyl Olivate, Prunus Armeniaca (Apricot) Kernel Oil, Saccharomyces (Hungarian Thermal Water) Ferment Extract, Prunus Domestica (Plum) Seed Extract, Malpighia Punicifolia (Acerola) Fruit Extract, Tocopherol, Glycerin, Squalane, Phospholipids, Saccharomyces (Hungarian Thermal Water) Ferment Extract","['aqua (hungarian thermal water)', 'glycerin', 'cetearyl ethylhexanoate', 'squalane', 'corundum', 'stearyl heptanoate', 'cetearyl olivate', 'prunus armeniaca (apricot) kernel oil', 'saccharomyces (hungarian thermal water) ferment extract', 'prunus domestica (plum) seed extract', 'malpighia punicifolia (acerola) fruit extract', 'tocopherol', 'glycerin', 'squalane', 'phospholipids', 'saccharomyces (hungarian thermal water) ferment extract']"
https://incidecoder.com/products/the-ordinary-serum-foundation,The Ordinary Serum Foundation,The,"Cyclopentasiloxane, Aqua (Water), Caprylyl Methicone, Coconut Alkanes, Methyl Methacrylate Crosspolymer, Trimethylsiloxysilicate, PEG-9 Polydimethylsiloxyethyl Dimethicone, Coco-Caprylate/Caprate, Dimethicone/PEG-10/15 Crosspolymer, Tocopherol","['cyclopentasiloxane', 'aqua (water)', 'caprylyl methicone', 'coconut alkanes', 'methyl methacrylate crosspolymer', 'trimethylsiloxysilicate', 'peg-9 polydimethylsiloxyethyl dimethicone', 'coco-caprylate/caprate', 'dimethicone/peg-10/15 crosspolymer', 'tocopherol']"
https://incidecoder.com/products/tata-harper-nourishing-oil-cleanser,Tata Harper Nourishing Oil Cleanser,Tata,"Helianthus Annuus (Sunflower) Seed Oil*, Olea Europea (Olive) Oil*, Shea Butter Ethyl Esters, Polyglyceryl-4 Oleate, Prunus Armeniaca (Apricot) Kernel Oil*, Simmondsia Chinensis (Jojoba) Seed Oil*, Argania Spinosa (Argan) Kernel Oil*, Plukenetia Volubilis Seed Oil, Jojoba Esters, Olea Europea (Olive) Oil*, Argania Spinosa (Argan) Kernel Oil*, Plukenetia Volubilis Seed Oil, Calendula Officinalis (Calendula) Flower Extract*, Borago Officinalis (Borage) Leaf Extract*, Jojoba Esters, Calendula Officinalis (Calendula) Flower Extract*","['helianthus annuus (sunflower) seed oil*', 'olea europea (olive) oil*', 'shea butter ethyl esters', 'polyglyceryl-4 oleate', 'prunus armeniaca (apricot) kernel oil*', 'simmondsia chinensis (jojoba) seed oil*', 'argania spinosa (argan) kernel oil*', 'plukenetia volubilis seed oil', 'jojoba esters', 'olea europea (olive) oil*', 'argania spinosa (argan) kernel oil*', 'plukenetia volubilis seed oil', 'calendula officinalis (calendula) flower extract*', 'borago officinalis (borage) leaf extract*', 'jojoba esters', 'calendula officinalis (calendula) flower extract*']"
https://incidecoder.com/products/jordan-samuel-skin-the-performance-cream,Jordan Samuel Skin The Performance Cream,Jordan,"Camellia Sinensis (Green Tea) Water, Squalane (Olive Derived), Vegetable Glycerin, Jojoba Esters, Helianthus Annuus (Sunflower) Seed Wax, Acetyl Hexapeptide-8, Acetyl Octapeptide-3, Acetyl Hexapeptide-51 Amide, Sodium Hyaluronate, Chamomilla Recutita (Matricaria) Flower Extract, Acetyl Hexapeptide-8, Acetyl Octapeptide-3, Squalane (Olive Derived), Vegetable Glycerin, Sodium Hyaluronate, Jojoba Esters, Chamomilla Recutita (Matricaria) Flower Extract","['camellia sinensis (green tea) water', 'squalane (olive derived)', 'vegetable glycerin', 'jojoba esters', 'helianthus annuus (sunflower) seed wax', 'acetyl hexapeptide-8', 'acetyl octapeptide-3', 'acetyl hexapeptide-51 amide', 'sodium hyaluronate', 'chamomilla recutita (matricaria) flower extract', 'acetyl hexapeptide-8', 'acetyl octapeptide-3', 'squalane (olive derived)', 'vegetable glycerin', 'sodium hyaluronate', 'jojoba esters', 'chamomilla recutita (matricaria) flower extract']"
https://incidecoder.com/products/missha-time-revolution-first-treatment-essence-intensive,Missha Time Revolution First Treatment Essence Intensive,Missha,"Saccharomyces Ferment Filtrate, Bifida Ferment Lysate, Propanediol, Niacinamide, Polyquaternium-51, Amaranthus Caudatus Seed Extract, Betaine, Ulmus Davidiana Root Extract, Pentylene Glycol, Niacinamide, Phellodendron Amurense Bark Extract, Beta Vulgaris (Beet) Root Extract, Niacinamide, Adenosine, Hexapeptide-9, Lactic Acid, Niacinamide, Glycerin, Sodium Hyaluronate, Saccharomyces Ferment Filtrate, Phellodendron Amurense Bark Extract, Cassia Alata Leaf Extract","['saccharomyces ferment filtrate', 'bifida ferment lysate', 'propanediol', 'niacinamide', 'polyquaternium-51', 'amaranthus caudatus seed extract', 'betaine', 'ulmus davidiana root extract', 'pentylene glycol', 'niacinamide', 'phellodendron amurense bark extract', 'beta vulgaris (beet) root extract', 'niacinamide', 'adenosine', 'hexapeptide-9', 'lactic acid', 'niacinamide', 'glycerin', 'sodium hyaluronate', 'saccharomyces ferment filtrate', 'phellodendron amurense bark extract', 'cassia alata leaf extract']"
https://incidecoder.com/products/pyunkang-yul-pyunkang-yul-acne-facial-cleanser,"Pyunkang Yul ACNE, Facial Cleanser",Pyunkang,"Water, Cocamidopropyl Betaine, Sodium Methyl Oleoyl Taurate, PEG-75, Acrylates Copolymer, Glycerin, Disodium Cocoamphodipropionate, PEG-120 Methyl Glucose Dioleate, Dimethyl Sulfone, Forsythia Suspensa Fruit Extract, Centella Asiatica Extract, Polygonum Cuspidatum Root Extract, Scutellaria Baicalensis Root Extract, Camellia Sinensis Leaf Extract, Chamomilla Recutita (Matricaria) Flower Extract, Rosmarinus Officinalis (Rosemary) Leaf Extract, Copper Tripeptide-1, Copper Tripeptide-1, Glycerin, Salix Alba (Willow) Bark Extract, Centella Asiatica Extract, Scutellaria Baicalensis Root Extract, Camellia Sinensis Leaf Extract, Chamomilla Recutita (Matricaria) Flower Extract, Rosmarinus Officinalis (Rosemary) Leaf Extract, Copper Tripeptide-1, Allantoin","['water', 'cocamidopropyl betaine', 'sodium methyl oleoyl taurate', 'peg-75', 'acrylates copolymer', 'glycerin', 'disodium cocoamphodipropionate', 'peg-120 methyl glucose dioleate', 'dimethyl sulfone', 'forsythia suspensa fruit extract', 'centella asiatica extract', 'polygonum cuspidatum root extract', 'scutellaria baicalensis root extract', 'camellia sinensis leaf extract', 'chamomilla recutita (matricaria) flower extract', 'rosmarinus officinalis (rosemary) leaf extract', 'copper tripeptide-1', 'copper tripeptide-1', 'glycerin', 'salix alba (willow) bark extract', 'centella asiatica extract', 'scutellaria baicalensis root extract', 'camellia sinensis leaf extract', 'chamomilla recutita (matricaria) flower extract', 'rosmarinus officinalis (rosemary) leaf extract', 'copper tripeptide-1', 'allantoin']"
https://incidecoder.com/products/erasa-xep-30,Erasa Xep-30,Erasa,"Water (Aqua), Cyclopentasiloxane, Polysilicone-11, Dimethyl Isosorbide, Adipic Acid/Neopentyl Glycol Crosspolymer, Polyethylene, Dimethicone, Pentylene Glycol, Squalane, Niacinamide, Caffeine, Magnolia Grandiflora Bark Extract, Betula Alba Bark Extract, Centella Asiatica Extract, Niacinamide, Whey Protein, Mu-Conotoxin Cniiic, Acetyl Hexapeptide-8, Palmitoyl Hexapeptide-52, Palmitoyl Heptapeptide-18, Lactic Acid, Glycolic Acid, Niacinamide, Glabridin, Acetyl Glucosamine, Squalane, Glycerin, Sodium Hyaluronate, Glycine, Acetyl Glucosamine, Sucrose, Betula Alba Bark Extract, Centella Asiatica Extract","['water (aqua)', 'cyclopentasiloxane', 'polysilicone-11', 'dimethyl isosorbide', 'adipic acid/neopentyl glycol crosspolymer', 'polyethylene', 'dimethicone', 'pentylene glycol', 'squalane', 'niacinamide', 'caffeine', 'magnolia grandiflora bark extract', 'betula alba bark extract', 'centella asiatica extract', 'niacinamide', 'whey protein', 'mu-conotoxin cniiic', 'acetyl hexapeptide-8', 'palmitoyl hexapeptide-52', 'palmitoyl heptapeptide-18', 'lactic acid', 'glycolic acid', 'niacinamide', 'glabridin', 'acetyl glucosamine', 'squalane', 'glycerin', 'sodium hyaluronate', 'glycine', 'acetyl glucosamine', 'sucrose', 'betula alba bark extract', 'centella asiatica extract']"
https://incidecoder.com/products/the-ordinary-salicylic-acid-2-masque,The Ordinary Salicylic Acid 2% Masque,The,"Aqua (Water), Kaolin, Squalane, Glycerin, Dimethyl Isosorbide, Silica Cetyl Silylate, Salicylic Acid, Sodium Polyacrylate, Pentylene Glycol, Salicylic Acid, 4-T-Butylcyclohexanol, Salicylic Acid, Squalane, Glycerin, Salicylic Acid, 4-T-Butylcyclohexanol","['aqua (water)', 'kaolin', 'squalane', 'glycerin', 'dimethyl isosorbide', 'silica cetyl silylate', 'salicylic acid', 'sodium polyacrylate', 'pentylene glycol', 'salicylic acid', '4-t-butylcyclohexanol', 'salicylic acid', 'squalane', 'glycerin', 'salicylic acid', '4-t-butylcyclohexanol']"
