product_url,name,brand,ingredients_raw,ingredients_list
https://incidecoder.com/products/sk-ii-genoptics-aura-essence,SK-II Genoptics Aura Essence,SK-II,"Pitera (Galactomyces Ferment Filtrate), Niacinamide, Butylene Glycol, Triethylhexanoin, Glycerin, Pentylene Glycol, Nylon-12, Phytosteryl / Octyldodecyl Lauroyl Glutamate, Polymethylsilsesquioxane, Niacinamide, Ascorbyl Glucoside, Niacinamide, Niacinamide, Undecylenoyl Phenylalanine, Ascorbyl Glucoside, Glycerin, Panthenol, Titanium Dioxide","['pitera (galactomyces ferment filtrate)', 'niacinamide', 'butylene glycol', 'triethylhexanoin', 'glycerin', 'pentylene glycol', 'nylon-12', 'phytosteryl / octyldodecyl lauroyl glutamate', 'polymethylsilsesquioxane', 'niacinamide', 'ascorbyl glucoside', 'niacinamide', 'niacinamide', 'undecylenoyl phenylalanine', 'ascorbyl glucoside', 'glycerin', 'panthenol', 'titanium dioxide']"
https://incidecoder.com/products/glossier-priming-moisturizer,Glossier Priming Moisturizer,Glossier,"Aqua/Water/Eau, Tridecyl Stearate, Neopentyl Glycol Dicaprylate/Dicaprate, Stearic Acid, Propanediol, Tridecyl Trimellitate, Palmitic Acid, Glyceryl Stearate Se, Tropaeolum Majus Flower/Leaf/Stem Extract, Tremella Fuciformis Sporocarp Extract, Camellia Sinensis Leaf Extract, Tocopheryl Acetate, Tetrapeptide-14, Retinyl Palmitate, Phospholipids, Hyaluronic Acid, Glycerin, Lonicera Japonica (Honeysuckle) Flower Extract, Aloe Barbadensis Leaf Juice, Boswellia Serrata Extract, Camellia Sinensis Leaf Extract, Tetrapeptide-14","['aqua/water/eau', 'tridecyl stearate', 'neopentyl glycol dicaprylate/dicaprate', 'stearic acid', 'propanediol', 'tridecyl trimellitate', 'palmitic acid', 'glyceryl stearate se', 'tropaeolum majus flower/leaf/stem extract', 'tremella fuciformis sporocarp extract', 'camellia sinensis leaf extract', 'tocopheryl acetate', 'tetrapeptide-14', 'retinyl palmitate', 'phospholipids', 'hyaluronic acid', 'glycerin', 'lonicera japonica (honeysuckle) flower extract', 'aloe barbadensis leaf juice', 'boswellia serrata extract', 'camellia sinensis leaf extract', 'tetrapeptide-14']"
https://incidecoder.com/products/clinique-take-the-day-off-cleansing-balm,Clinique Take The Day Off Cleansing Balm,Clinique,"Ethylhexyl Palmitate, Carthamus Tinctorius (Safflower) Seed Oil, Caprylic/Capric Triglyceride, Sorbeth-30 Tetraoleate, Polyethylene, Peg-5 Glyceryl Triisostearate, Water, Tocopherol, Phenoxyethanol, Carthamus Tinctorius (Safflower) Seed Oil, Tocopherol","['ethylhexyl palmitate', 'carthamus tinctorius (safflower) seed oil', 'caprylic/capric triglyceride', 'sorbeth-30 tetraoleate', 'polyethylene', 'peg-5 glyceryl triisostearate', 'water', 'tocopherol', 'phenoxyethanol', 'carthamus tinctorius (safflower) seed oil', 'tocopherol']"
https://incidecoder.com/products/acne-org-aha-glycolic-acid-10,Acne.org Aha+ (Glycolic Acid - 10%),Acne.org,"Water, Glycolic Acid, Sodium Hydroxide, C12-15 Alkyl Benzoate, Cetyl Palmitate, Sorbitan Stearate, Glycerin, Cyclomethicone, Glyceryl Stearate, Tocopheryl Acetate, Glycolic Acid, Glycyrrhiza Glabra (Licorice) Root Extract (Licochalcone), Glycerin, Squalane, Glycyrrhiza Glabra (Licorice) Root Extract (Licochalcone)","['water', 'glycolic acid', 'sodium hydroxide', 'c12-15 alkyl benzoate', 'cetyl palmitate', 'sorbitan stearate', 'glycerin', 'cyclomethicone', 'glyceryl stearate', 'tocopheryl acetate', 'glycolic acid', 'glycyrrhiza glabra (licorice) root extract (licochalcone)', 'glycerin', 'squalane', 'glycyrrhiza glabra (licorice) root extract (licochalcone)']"
https://incidecoder.com/products/biologique-recherche-lotion-p50-pigm-400,Biologique Recherche Lotion P50 Pigm 400,Biologique,"Water (Aqua), Glycerin, Niacinamide, Sodium Gluconate, Lactic Acid, Sodium Lactate, Lactobacillus/Wasabia Japonica Root Ferment Extract, Magnesium Chloride, Mandelic Acid, Niacinamide, Salicylic Acid, Lactobacillus/Wasabia Japonica Root Ferment Extract, Ascorbic Acid, Rubus Idaeus (Raspberry) Fruit Extract, Niacinamide, Lactic Acid, Mandelic Acid, Gluconolactone, Salicylic Acid, Microcitrus Australasica Fruit Extract, Niacinamide, Ascorbic Acid, Glycerin, Salicylic Acid, Spiraea Ulmaria Extract, Rubus Idaeus (Raspberry) Fruit Extract","['water (aqua)', 'glycerin', 'niacinamide', 'sodium gluconate', 'lactic acid', 'sodium lactate', 'lactobacillus/wasabia japonica root ferment extract', 'magnesium chloride', 'mandelic acid', 'niacinamide', 'salicylic acid', 'lactobacillus/wasabia japonica root ferment extract', 'ascorbic acid', 'rubus idaeus (raspberry) fruit extract', 'niacinamide', 'lactic acid', 'mandelic acid', 'gluconolactone', 'salicylic acid', 'microcitrus australasica fruit extract', 'niacinamide', 'ascorbic acid', 'glycerin', 'salicylic acid', 'spiraea ulmaria extract', 'rubus idaeus (raspberry) fruit extract']"
https://incidecoder.com/products/oskia-perfect-cleanser,oskia Perfect Cleanser,oskia,"Prunus Amygdalus Dulcis (Sweet Almond) Oil, Glycerin, Sesamum Indicum (Sesame) Seed Oil, Decyl Oleate, Glyceryl Stearate, Caprylic/Capric Triglyceride, Glyceryl Dibehenate, Glyceryl Cocoate, Tribehenin, Calendula Officinalis Flower Extract, Tocopherol, Glycerin, Calendula Officinalis Flower Extract, Aleurites Moluccana (Kukui) Seed Oil","['prunus amygdalus dulcis (sweet almond) oil', 'glycerin', 'sesamum indicum (sesame) seed oil', 'decyl oleate', 'glyceryl stearate', 'caprylic/capric triglyceride', 'glyceryl dibehenate', 'glyceryl cocoate', 'tribehenin', 'calendula officinalis flower extract', 'tocopherol', 'glycerin', 'calendula officinalis flower extract', 'aleurites moluccana (kukui) seed oil']"
https://incidecoder.com/products/dr-dennis-gross-c-collagen-mist-perfect-skin-set-refresh,Dr Dennis Gross C+ Collagen Mist Perfect Skin Set & Refresh,Dr,"Water, Propylene Glycol, Polysorbate 20, 3-O-Ethyl Ascorbic Acid, Ascorbic Acid, Collagen Amino Acids, Niacinamide, Panthenol, Superoxide Dismutase, Niacinamide, 3-O-Ethyl Ascorbic Acid, Ascorbic Acid, Superoxide Dismutase, Ubiquinone, Colloidal Oatmeal, Tocopheryl Acetate, Soy Isoflavones, Camellia Sinensis Leaf Extract, Rubus Idaeus (Raspberry) Fruit Extract, Rosmarinus Officinalis (Rosemary) Leaf Extract, Niacinamide, Glycolic Acid, 3-O-Ethyl Ascorbic Acid, Ascorbic Acid, Niacinamide, Collagen Amino Acids, Sodium Hyaluronate, Phospholipids, Sodium Pca, Glycerin, Panthenol, Colloidal Oatmeal, Aloe Barbadensis Leaf Juice, Camellia Sinensis Leaf Extract, Cucumis Sativus (Cucumber) Fruit Extract, Rubus Idaeus (Raspberry) Fruit Extract, Rosmarinus Officinalis (Rosemary) Leaf Extract, Fucus Vesiculosus Extract","['water', 'propylene glycol', 'polysorbate 20', '3-o-ethyl ascorbic acid', 'ascorbic acid', 'collagen amino acids', 'niacinamide', 'panthenol', 'superoxide dismutase', 'niacinamide', '3-o-ethyl ascorbic acid', 'ascorbic acid', 'superoxide dismutase', 'ubiquinone', 'colloidal oatmeal', 'tocopheryl acetate', 'soy isoflavones', 'camellia sinensis leaf extract', 'rubus idaeus (raspberry) fruit extract', 'rosmarinus officinalis (rosemary) leaf extract', 'niacinamide', 'glycolic acid', '3-o-ethyl ascorbic acid', 'ascorbic acid', 'niacinamide', 'collagen amino acids', 'sodium hyaluronate', 'phospholipids', 'sodium pca', 'glycerin', 'panthenol', 'colloidal oatmeal', 'aloe barbadensis leaf juice', 'camellia sinensis leaf extract', 'cucumis sativus (cucumber) fruit extract', 'rubus idaeus (raspberry) fruit extract', 'rosmarinus officinalis (rosemary) leaf extract', 'fucus vesiculosus extract']"
https://incidecoder.com/products/aurelia-probiotic-skincare-revitalise-glow-serum-discontinued,Aurelia Probiotic Skincare Revitalise & Glow Serum (Discontinued),Aurelia,"Aqua/ Water, Aloe Barbadensis Leaf Extract, Bifida Ferment Lysate, Cocoglycerides, Glycerin, Lactose, Lactis Proteinum/ Milk Protein, Coco-Caprylate, Cetearyl Glucoside, Kigelia Africana Fruit Extract, Tocopherol, Glycerin, Aloe Barbadensis Leaf Extract, Kigelia Africana Fruit Extract","['aqua/ water', 'aloe barbadensis leaf extract', 'bifida ferment lysate', 'cocoglycerides', 'glycerin', 'lactose', 'lactis proteinum/ milk protein', 'coco-caprylate', 'cetearyl glucoside', 'kigelia africana fruit extract', 'tocopherol', 'glycerin', 'aloe barbadensis leaf extract', 'kigelia africana fruit extract']"
https://incidecoder.com/products/hylamide-booster-low-molecular-ha,Hylamide Booster;Low-Molecular Ha,Hylamide,"Aqua (Water), Hydrolyzed Yeast Extract, Pentylene Glycol, Tamarindus Indica Seed Gum, Sodium Hyaluronate Crosspolymer, Hydrolyzed Sodium Hyaluronate, Sodium Hyaluronate, Tremella Fuciformis Sporocarp Extract, Ahnfeltia Concinna Extract, Sodium Hyaluronate Crosspolymer, Tremella Fuciformis Sporocarp Extract, Sodium Hyaluronate Crosspolymer, Sodium Hyaluronate, Glycerin","['aqua (water)', 'hydrolyzed yeast extract', 'pentylene glycol', 'tamarindus indica seed gum', 'sodium hyaluronate crosspolymer', 'hydrolyzed sodium hyaluronate', 'sodium hyaluronate', 'tremella fuciformis sporocarp extract', 'ahnfeltia concinna extract', 'sodium hyaluronate crosspolymer', 'tremella fuciformis sporocarp extract', 'sodium hyaluronate crosspolymer', 'sodium hyaluronate', 'glycerin']"
https://incidecoder.com/products/tatcha-pure-one-step-camellia-cleansing-oil,Tatcha Pure One Step Camellia Cleansing Oil,Tatcha,"Cetyl Ethylhexanoate, Oryza Sativa (Rice) Bran Oil, Polyglyceryl-10 Dioleate, Polyglyceryl-2 Sesquicaprylate, Camellia Japonica Seed Oil, Saccharomyces/Rice Ferment Filtrate, Camellia Sinensis Leaf Extract, Cladosiphon Okamuranus Extract, Aqua/Water/Eau, Oryza Sativa (Rice) Bran Oil, Camellia Sinensis Leaf Extract, Tocopherol, Camellia Sinensis Leaf Extract","['cetyl ethylhexanoate', 'oryza sativa (rice) bran oil', 'polyglyceryl-10 dioleate', 'polyglyceryl-2 sesquicaprylate', 'camellia japonica seed oil', 'saccharomyces/rice ferment filtrate', 'camellia sinensis leaf extract', 'cladosiphon okamuranus extract', 'aqua/water/eau', 'oryza sativa (rice) bran oil', 'camellia sinensis leaf extract', 'tocopherol', 'camellia sinensis leaf extract']"
https://incidecoder.com/products/nydg-formula-119-cream,NYDG Formula 119 Cream,NYDG,"Water (Aqua), Glycerin, Dimethicone, Pentylene Glycol, PPG-3 Benzyl Ether Myristate, Phenyl Trimethicone, Isosorbide Dicaprylate, Butyrospermum Parkii (Shea) Oil, Cetearyl Alcohol, Tocopherol, Tetrahexyldecyl Ascorbate, Panax Ginseng Root Extract, Chamomilla Recutita (Matricaria) Flower Extract, Vitis Vinifera (Grape) Seed Extract, Camellia Oleifera Leaf Extract, Isosorbide Dicaprylate, Palmitoyl Tripeptide-5, Tetradecyl Aminobutyroylvalylaminobutyric Urea Trifluoroacetate, Palmitoyl Dipeptide-5 Diaminobutyroyl Hydroxythreonine, Palmitoyl Tripeptide-38, Tetrahexyldecyl Ascorbate, Glycerin, Sodium Hyaluronate, Chamomilla Recutita (Matricaria) Flower Extract, Camellia Oleifera Leaf Extract","['water (aqua)', 'glycerin', 'dimethicone', 'pentylene glycol', 'ppg-3 benzyl ether myristate', 'phenyl trimethicone', 'isosorbide dicaprylate', 'butyrospermum parkii (shea) oil', 'cetearyl alcohol', 'tocopherol', 'tetrahexyldecyl ascorbate', 'panax ginseng root extract', 'chamomilla recutita (matricaria) flower extract', 'vitis vinifera (grape) seed extract', 'camellia oleifera leaf extract', 'isosorbide dicaprylate', 'palmitoyl tripeptide-5', 'tetradecyl aminobutyroylvalylaminobutyric urea trifluoroacetate', 'palmitoyl dipeptide-5 diaminobutyroyl hydroxythreonine', 'palmitoyl tripeptide-38', 'tetrahexyldecyl ascorbate', 'glycerin', 'sodium hyaluronate', 'chamomilla recutita (matricaria) flower extract', 'camellia oleifera leaf extract']"
https://incidecoder.com/products/bioderma-hydrabio-creme,Bioderma Hydrabio Creme,Bioderma,"Aqua/Water/Eau, Glycerin, Isododecane, Cyclopentasiloxane, Propylene Glycol Dicaprylate/Dicaprate, Dimethicone, Propanediol, Xylitol, Cetyl Palmitate, Niacinamide, Salicylic Acid, Tocopheryl Acetate, Tocopherol, Niacinamide, Salicylic Acid, Niacinamide, Glycerin, Squalane, Sodium Hyaluronate, Salicylic Acid","['aqua/water/eau', 'glycerin', 'isododecane', 'cyclopentasiloxane', 'propylene glycol dicaprylate/dicaprate', 'dimethicone', 'propanediol', 'xylitol', 'cetyl palmitate', 'niacinamide', 'salicylic acid', 'tocopheryl acetate', 'tocopherol', 'niacinamide', 'salicylic acid', 'niacinamide', 'glycerin', 'squalane', 'sodium hyaluronate', 'salicylic acid']"
https://incidecoder.com/products/paulas-choice-ceramide-enriched-firming-eye-cream,Paula's Choice Clinical Ceramide Enriched Firming Eye Cream,Paula's,"Water (Aqua), Neopentyl Glycol Diheptanoate, Cetyl Alcohol, Butylene Glycol, Glycerin, Glyceryl Stearate, PEG-100 Stearate, Ammonium Acryloyldimethyltaurate/Vp Copolymer, Ascorbyl Glucoside, Sodium Ascorbyl Phosphate, Ascorbyl Glucoside, Sodium Ascorbyl Phosphate, Tetrahexyldecyl Ascorbate, Vitis Vinifera (Grape) Seed Extract, Tocopheryl Acetate, Carnosine, Glyceryl Ascorbate, Propyl Gallate, Palmitoyl Tripeptide-5, Acetyl Tetrapeptide-5, Retinol, Carnosine, Ascorbyl Glucoside, Tetrahexyldecyl Ascorbate, Glycyrrhiza Glabra (Licorice) Root Extract, Glycerin, Ceramide Ns, Ceramide Eop, Ceramide AP, Ceramide NP, Sodium Hyaluronate, Cholesterol, Squalane, Sodium Pca, Glycyrrhiza Glabra (Licorice) Root Extract, Allantoin, Bisabolol, Panthenol","['water (aqua)', 'neopentyl glycol diheptanoate', 'cetyl alcohol', 'butylene glycol', 'glycerin', 'glyceryl stearate', 'peg-100 stearate', 'ammonium acryloyldimethyltaurate/vp copolymer', 'ascorbyl glucoside', 'sodium ascorbyl phosphate', 'ascorbyl glucoside', 'sodium ascorbyl phosphate', 'tetrahexyldecyl ascorbate', 'vitis vinifera (grape) seed extract', 'tocopheryl acetate', 'carnosine', 'glyceryl ascorbate', 'propyl gallate', 'palmitoyl tripeptide-5', 'acetyl tetrapeptide-5', 'retinol', 'carnosine', 'ascorbyl glucoside', 'tetrahexyldecyl ascorbate', 'glycyrrhiza glabra (licorice) root extract', 'glycerin', 'ceramide ns', 'ceramide eop', 'ceramide ap', 'ceramide np', 'sodium hyaluronate', 'cholesterol', 'squalane', 'sodium pca', 'glycyrrhiza glabra (licorice) root extract', 'allantoin', 'bisabolol', 'panthenol']"
https://incidecoder.com/products/tatcha-the-essence-discontinued,Tatcha The Essence (Discontinued),Tatcha,"Saccharomyces/Camellia Sinensis Leaf/Cladosiphon Okamuranus/Rice Ferment Filtrate*, Propanediol, Soy Amino Acids, Yeast Extract, Aqua/Water/Eau, Ethylhexylglycerin, Sodium Dilauramidoglutamide Lysine, Phenoxyethanol, Sodium Dilauramidoglutamide Lysine, Saccharomyces/Camellia Sinensis Leaf/Cladosiphon Okamuranus/Rice Ferment Filtrate*, Propanediol, Soy Amino Acids, Yeast Extract, Sodium Dilauramidoglutamide Lysine, Ethylhexylglycerin, Phenoxyethanol, Propanediol, Aqua/Water/Eau","['saccharomyces/camellia sinensis leaf/cladosiphon okamuranus/rice ferment filtrate*', 'propanediol', 'soy amino acids', 'yeast extract', 'aqua/water/eau', 'ethylhexylglycerin', 'sodium dilauramidoglutamide lysine', 'phenoxyethanol', 'sodium dilauramidoglutamide lysine', 'saccharomyces/camellia sinensis leaf/cladosiphon okamuranus/rice ferment filtrate*', 'propanediol', 'soy amino acids', 'yeast extract', 'sodium dilauramidoglutamide lysine', 'ethylhexylglycerin', 'phenoxyethanol', 'propanediol', 'aqua/water/eau']"
https://incidecoder.com/products/nip-fab-glycolic-fix-night-pads-extreme,Nip+Fab Glycolic Fix Night Pads Extreme,Nip+Fab,"Aqua (Water/Eau), Glycolic Acid, Triethanolamine, Glycerin, Polysorbate 20, Niacinamide, Phenoxyethanol, Sodium Hydroxide, Benzyl Alcohol, Niacinamide, Salicylic Acid, Niacinamide, Glycolic Acid, Mandelic Acid, Salicylic Acid, Lactic Acid, Niacinamide, Glycerin, Sodium Hyaluronate, Panthenol, Salicylic Acid","['aqua (water/eau)', 'glycolic acid', 'triethanolamine', 'glycerin', 'polysorbate 20', 'niacinamide', 'phenoxyethanol', 'sodium hydroxide', 'benzyl alcohol', 'niacinamide', 'salicylic acid', 'niacinamide', 'glycolic acid', 'mandelic acid', 'salicylic acid', 'lactic acid', 'niacinamide', 'glycerin', 'sodium hyaluronate', 'panthenol', 'salicylic acid']"
https://incidecoder.com/products/the-ordinary-buffet-copper-peptides-1,The Ordinary Buffet + Copper Peptides 1%,The,"Aqua (Water), Glycerin, Lactococcus Ferment Lysate, Copper Tripeptide-1, Acetyl Hexapeptide-8, Pentapeptide-18, Palmitoyl Tripeptide-1, Palmitoyl Tetrapeptide-7, Palmitoyl Tripeptide-38, Copper Tripeptide-1, Sodium Hyaluronate Crosspolymer, Copper Tripeptide-1, Acetyl Hexapeptide-8, Pentapeptide-18, Palmitoyl Tripeptide-1, Palmitoyl Tetrapeptide-7, Palmitoyl Tripeptide-38, Dipeptide Diaminobutyroyl Benzylamide Diacetate, Acetylarginyltryptophyl Diphenylglycine, Glycerin, Sodium Hyaluronate Crosspolymer, Sodium Hyaluronate, Glycine, Alanine, Serine, Valine, Isoleucine, Proline, Threonine, Histidine, Phenylalanine, Arginine, Aspartic Acid, Urea, Sodium Pca, Pca, Copper Tripeptide-1, Allantoin","['aqua (water)', 'glycerin', 'lactococcus ferment lysate', 'copper tripeptide-1', 'acetyl hexapeptide-8', 'pentapeptide-18', 'palmitoyl tripeptide-1', 'palmitoyl tetrapeptide-7', 'palmitoyl tripeptide-38', 'copper tripeptide-1', 'sodium hyaluronate crosspolymer', 'copper tripeptide-1', 'acetyl hexapeptide-8', 'pentapeptide-18', 'palmitoyl tripeptide-1', 'palmitoyl tetrapeptide-7', 'palmitoyl tripeptide-38', 'dipeptide diaminobutyroyl benzylamide diacetate', 'acetylarginyltryptophyl diphenylglycine', 'glycerin', 'sodium hyaluronate crosspolymer', 'sodium hyaluronate', 'glycine', 'alanine', 'serine', 'valine', 'isoleucine', 'proline', 'threonine', 'histidine', 'phenylalanine', 'arginine', 'aspartic acid', 'urea', 'sodium pca', 'pca', 'copper tripeptide-1', 'allantoin']"
https://incidecoder.com/products/bareminerals-complexion-rescue,bareMinerals Complexion Rescue Tinted Hydrating Gel Cream SPF 30,bareMinerals,"Titanium Dioxide (6.2%), Water, Coconut Alkanes, Propanediol, Squalane, Trehalose, Isostearic Acid, Glycerin, Silica, Salicornia Herbacea Extract, Salicornia Herbacea Extract, Squalane, Glycerin, Sodium Hyaluronate, Globularia Cordifolia Callus Culture Extract, Melilotus Officinalis Extract, Titanium Dioxide (6.2%)","['titanium dioxide (6.2%)', 'water', 'coconut alkanes', 'propanediol', 'squalane', 'trehalose', 'isostearic acid', 'glycerin', 'silica', 'salicornia herbacea extract', 'salicornia herbacea extract', 'squalane', 'glycerin', 'sodium hyaluronate', 'globularia cordifolia callus culture extract', 'melilotus officinalis extract', 'titanium dioxide (6.2%)']"
https://incidecoder.com/products/niod-non-acid-acid-precursor-15,NIOD Non-Acid Acid Precursor 15%,NIOD,"Aqua (Water), Lactococcus Ferment Lysate, Glycerin, Ethyl Linoleate, Hydroxyethyl Acrylate/Sodium Acryloyldimethyl Taurate Copolymer, Hexanoyl Dipeptide-3 Norleucine Acetate, Myristoyl Nonapeptide-3, Yeast Extract, Soy Amino Acids, Hexanoyl Dipeptide-3 Norleucine Acetate, Myristoyl Nonapeptide-3, Glycerin, Bisabolol","['aqua (water)', 'lactococcus ferment lysate', 'glycerin', 'ethyl linoleate', 'hydroxyethyl acrylate/sodium acryloyldimethyl taurate copolymer', 'hexanoyl dipeptide-3 norleucine acetate', 'myristoyl nonapeptide-3', 'yeast extract', 'soy amino acids', 'hexanoyl dipeptide-3 norleucine acetate', 'myristoyl nonapeptide-3', 'glycerin', 'bisabolol']"
https://incidecoder.com/products/super-facialist-vitamin-c-skin-renew-cleansing-oil-2,Super Facialist Vitamin C+ Skin Renew Cleansing Oil,Super,"Helianthus Annuus (Sunflower) Seed Oil, Olea Europaea (Olive) Fruit Oil, Vitis Vinifera (Grape) Seed Oil, Laureth-4, Peg-7 Glyceryl Cocoate, Rubus Idaeus (Raspberry) Seed Oil, Parfum (Fragrance), Citrus Aurantium Dulcis (Sweet Orange) Peel Oil, Passiflora Edulis (Passionflower) Seed Oil, Olea Europaea (Olive) Fruit Oil, Vitis Vinifera (Grape) Seed Oil, Rosa Eglanteria (Rosehip) Seed Oil, Ascorbyl Tetraisopalmitate, Tocopheryl Acetate, Ascorbyl Tetraisopalmitate","['helianthus annuus (sunflower) seed oil', 'olea europaea (olive) fruit oil', 'vitis vinifera (grape) seed oil', 'laureth-4', 'peg-7 glyceryl cocoate', 'rubus idaeus (raspberry) seed oil', 'parfum (fragrance)', 'citrus aurantium dulcis (sweet orange) peel oil', 'passiflora edulis (passionflower) seed oil', 'olea europaea (olive) fruit oil', 'vitis vinifera (grape) seed oil', 'rosa eglanteria (rosehip) seed oil', 'ascorbyl tetraisopalmitate', 'tocopheryl acetate', 'ascorbyl tetraisopalmitate']"
https://incidecoder.com/products/sarah-chapman-skinesis-overnight-exfoliating-booster,Sarah Chapman Skinesis Overnight Exfoliating Booster,Sarah,"Aqua, Propanediol, Polysorbate 20, Lactic Acid, Cyclomethicone (Pentamer), Dimethicone, Peg-8 Dimethicone, Xanthan Gum, Phenoxyethanol, Rosa Damascena Flower Oil, Ficus Indica Flower / Leaf / Stem Juice, Retinol, Lactic Acid, Salix Alba Bark Extract","['aqua', 'propanediol', 'polysorbate 20', 'lactic acid', 'cyclomethicone (pentamer)', 'dimethicone', 'peg-8 dimethicone', 'xanthan gum', 'phenoxyethanol', 'rosa damascena flower oil', 'ficus indica flower / leaf / stem juice', 'retinol', 'lactic acid', 'salix alba bark extract']"
https://incidecoder.com/products/alpha-h-liquid-laser-cleansing-oil,Alpha-H Liquid Laser Cleansing Oil,Alpha-H,"Caprylic/Capric Triglyceride, Glycerin, Aqua, Sucrose Laurate, Phenoxyethanol, Sucrose Palmitate, Sucrose Stearate, Caprylyl Glycol, Ammonium Glycyrrhizate, Ethyl Ascorbic Acid, Ferulic Acid, Ethyl Ascorbic Acid, Glycerin","['caprylic/capric triglyceride', 'glycerin', 'aqua', 'sucrose laurate', 'phenoxyethanol', 'sucrose palmitate', 'sucrose stearate', 'caprylyl glycol', 'ammonium glycyrrhizate', 'ethyl ascorbic acid', 'ferulic acid', 'ethyl ascorbic acid', 'glycerin']"
https://incidecoder.com/products/uncover-suncover,Dr. Jetske Ultee Suncover SPF 30,Dr.,"Aqua, C12-15 Alkyl Benzoate, Propylheptyl Caprylate, Diethylamino Hydroxybenzoyl Hexyl Benzoate, Cetearyl Alcohol, Bis-Ethylhexyloxyphenol Methoxyphenyl Triazine, Phenylbenzimidazole Sulfonic Acid, Tris-Biphenyl Triazine (Nano), Xylityl Sesquicaprylate, Niacinamide, Niacinamide, Lactic Acid, Niacinamide, Glycerin, Squalane, Diethylamino Hydroxybenzoyl Hexyl Benzoate, Bis-Ethylhexyloxyphenol Methoxyphenyl Triazine, Phenylbenzimidazole Sulfonic Acid, Tris-Biphenyl Triazine (Nano)","['aqua', 'c12-15 alkyl benzoate', 'propylheptyl caprylate', 'diethylamino hydroxybenzoyl hexyl benzoate', 'cetearyl alcohol', 'bis-ethylhexyloxyphenol methoxyphenyl triazine', 'phenylbenzimidazole sulfonic acid', 'tris-biphenyl triazine (nano)', 'xylityl sesquicaprylate', 'niacinamide', 'niacinamide', 'lactic acid', 'niacinamide', 'glycerin', 'squalane', 'diethylamino hydroxybenzoyl hexyl benzoate', 'bis-ethylhexyloxyphenol methoxyphenyl triazine', 'phenylbenzimidazole sulfonic acid', 'tris-biphenyl triazine (nano)']"
https://incidecoder.com/products/the-ordinary-natural-moisturizing-factors-ha,The Ordinary Natural Moisturizing Factors + Ha,The,"Aqua (Water), Caprylic/Capric Triglyceride, Cetyl Alcohol, Propanediol, Stearyl Alcohol, Glycerin, Sodium Hyaluronate, Arginine, Aspartic Acid, Tocopherol, Glycerin, Sodium Hyaluronate, Arginine, Aspartic Acid, Glycine, Alanine, Serine, Valine, Isoleucine, Proline, Threonine, Histidine, Phenylalanine, Sodium PCA, PCA, Urea, Linoleic Acid, Allantoin","['aqua (water)', 'caprylic/capric triglyceride', 'cetyl alcohol', 'propanediol', 'stearyl alcohol', 'glycerin', 'sodium hyaluronate', 'arginine', 'aspartic acid', 'tocopherol', 'glycerin', 'sodium hyaluronate', 'arginine', 'aspartic acid', 'glycine', 'alanine', 'serine', 'valine', 'isoleucine', 'proline', 'threonine', 'histidine', 'phenylalanine', 'sodium pca', 'pca', 'urea', 'linoleic acid', 'allantoin']"
https://incidecoder.com/products/the-ordinary-b-oil,"The Ordinary ""B"" Oil",The,"Caprylic/Capric Triglyceride, Squalane, Crambe Abyssinica Seed Oil, Bisabolol, Simmondsia Chinensis Seed Oil, Ethylhexyl Stearate, Isochrysis Galbana Extract, Adansonia Digitata Seed Oil, Argania Spinosa Kernel Oil, Argania Spinosa Kernel Oil, Plukenetia Volubilis Seed Oil, Solanum Lycopersicum (Tomato) Fruit Extract, Hydroxymethoxyphenyl Decanone, Rosmarinus Officinalis (Rosemary) Leaf Extract, Tocopherol, Squalane, Bisabolol, Borago Officinalis Seed Oil, Hydroxymethoxyphenyl Decanone, Rosmarinus Officinalis (Rosemary) Leaf Extract","['caprylic/capric triglyceride', 'squalane', 'crambe abyssinica seed oil', 'bisabolol', 'simmondsia chinensis seed oil', 'ethylhexyl stearate', 'isochrysis galbana extract', 'adansonia digitata seed oil', 'argania spinosa kernel oil', 'argania spinosa kernel oil', 'plukenetia volubilis seed oil', 'solanum lycopersicum (tomato) fruit extract', 'hydroxymethoxyphenyl decanone', 'rosmarinus officinalis (rosemary) leaf extract', 'tocopherol', 'squalane', 'bisabolol', 'borago officinalis seed oil', 'hydroxymethoxyphenyl decanone', 'rosmarinus officinalis (rosemary) leaf extract']"
https://incidecoder.com/products/dr-sam-bunting-flawless-daily-sunscreen-spf-50,Dr Sam Bunting Flawless Daily Sunscreen Spf 50,Dr,"Aqua (Water), Zinc Oxide (Nano), Octyldodecyl Neopentanoate, Caprylic/Capric Triglyceride, Ethylhexyl Methoxycinnamate, Niacinamide, Glyceryl Stearate, PEG-100 Stearate, Cetearyl Alcohol, Niacinamide, Tocopheryl Acetate, Niacinamide, Lactic Acid, Niacinamide, Squalane, Sodium Hyaluronate, Zinc Oxide (Nano), Ethylhexyl Methoxycinnamate","['aqua (water)', 'zinc oxide (nano)', 'octyldodecyl neopentanoate', 'caprylic/capric triglyceride', 'ethylhexyl methoxycinnamate', 'niacinamide', 'glyceryl stearate', 'peg-100 stearate', 'cetearyl alcohol', 'niacinamide', 'tocopheryl acetate', 'niacinamide', 'lactic acid', 'niacinamide', 'squalane', 'sodium hyaluronate', 'zinc oxide (nano)', 'ethylhexyl methoxycinnamate']"
